heute 16.05.2020 13:00:47,68

Wochentag     = Montag
TT.MM.JJ      = 22.02.16
TT.MM.JJJJ    = 22.02.2016
JJJJ-MM-TT    = 2016-02-22
HH:MM:SS      = 12:00:00
HH:MM:SS,MS   = 12:00:00,00
Timestamp     = 22.02.2016 12:00:00,00
Datum/Zeit    = Montag, 22.Februar 2016, 12:00:00
absolute Zeit = 736.015 Tage == 6.359.173.920.000 HS

Wochentag     = Freitag
TT.MM.JJ      = 01.01.16
TT.MM.JJJJ    = 01.01.2016
JJJJ-MM-TT    = 2016-01-01
HH:MM:SS      = 00:00:00
HH:MM:SS,MS   = 00:00:00,00
Timestamp     = 01.01.2016 00:00:00,00
Datum/Zeit    = Freitag, 01.Januar 2016, 00:00:00
absolute Zeit = 735.963 Tage == 6.358.720.320.000 HS
i=1
vorher: 6.358.720.320.000
nachher:6.362.202.606.101
Wochentag     = Dienstag
TT.MM.JJ      = 07.02.17
TT.MM.JJJJ    = 07.02.2017
JJJJ-MM-TT    = 2017-02-07
HH:MM:SS      = 01:01:01
HH:MM:SS,MS   = 01:01:01,01
Timestamp     = 07.02.2017 01:01:01,01
Datum/Zeit    = Dienstag, 07.Februar 2017, 01:01:01
absolute Zeit = 736.366 Tage == 6.362.202.606.101 HS
15.11.00 13:01:01,01
373:01:01,01
00 Jahre 11 Monate 15 Tage, 13:01:01,01
0,960 Jahre / 11,518 Monate / 50,077 Wochen / 350,542 Tage / 8.413,017 h / 504.781,017 min / 30.286.861,01 s
nachher:6.366.092.442.809
Wochentag     = Donnerstag
TT.MM.JJ      = 03.05.18
TT.MM.JJJJ    = 03.05.2018
JJJJ-MM-TT    = 2018-05-03
HH:MM:SS      = 06:07:08
HH:MM:SS,MS   = 06:07:08,09
Timestamp     = 03.05.2018 06:07:08,09
Datum/Zeit    = Donnerstag, 03.Mai 2018, 06:07:08
absolute Zeit = 736.816 Tage == 6.366.092.442.809 HS
10.02.02 18:07:08,09
258:07:08,09
02 Jahre 02 Monate 10 Tage, 18:07:08,09
2,193 Jahre / 26,310 Monate / 114,394 Wochen / 800,755 Tage / 19.218,119 h / 1.153.087,135 min / 69.185.228,09 s
i=2
vorher: 6.366.092.442.809
nachher:6.369.574.728.910
Wochentag     = Montag
TT.MM.JJ      = 10.06.19
TT.MM.JJJJ    = 10.06.2019
JJJJ-MM-TT    = 2019-06-10
HH:MM:SS      = 07:08:09
HH:MM:SS,MS   = 07:08:09,10
Timestamp     = 10.06.2019 07:08:09,10
Datum/Zeit    = Montag, 10.Juni 2019, 07:08:09
absolute Zeit = 737.219 Tage == 6.369.574.728.910 HS
18.03.03 19:08:09,10
451:08:09,10
03 Jahre 03 Monate 18 Tage, 19:08:09,10
3,296 Jahre / 39,553 Monate / 171,971 Wochen / 1.203,797 Tage / 28.891,136 h / 1.733.468,152 min / 104.008.089,10 s
nachher:6.373.464.565.618
Wochentag     = Mittwoch
TT.MM.JJ      = 02.09.20
TT.MM.JJJJ    = 02.09.2020
JJJJ-MM-TT    = 2020-09-02
HH:MM:SS      = 12:14:16
HH:MM:SS,MS   = 12:14:16,18
Timestamp     = 02.09.2020 12:14:16,18
Datum/Zeit    = Mittwoch, 02.September 2020, 12:14:16
absolute Zeit = 737.669 Tage == 6.373.464.565.618 HS
11.06.04 00:14:16,18
264:14:16,18
04 Jahre 06 Monate 11 Tage, 00:14:16,18
4,529 Jahre / 54,346 Monate / 236,287 Wochen / 1.654,010 Tage / 39.696,238 h / 2.381.774,270 min / 142.906.456,18 s
i=3
vorher: 6.373.464.565.618
nachher:6.376.946.851.719
Wochentag     = Sonntag
TT.MM.JJ      = 10.10.21
TT.MM.JJJJ    = 10.10.2021
JJJJ-MM-TT    = 2021-10-10
HH:MM:SS      = 13:15:17
HH:MM:SS,MS   = 13:15:17,19
Timestamp     = 10.10.2021 13:15:17,19
Datum/Zeit    = Sonntag, 10.Oktober 2021, 13:15:17
absolute Zeit = 738.072 Tage == 6.376.946.851.719 HS
18.07.05 01:15:17,19
433:15:17,19
05 Jahre 07 Monate 18 Tage, 01:15:17,19
5,632 Jahre / 67,588 Monate / 293,865 Wochen / 2.057,052 Tage / 49.369,255 h / 2.962.155,286 min / 177.729.317,19 s
nachher:6.380.836.688.427
Wochentag     = Dienstag
TT.MM.JJ      = 03.01.23
TT.MM.JJJJ    = 03.01.2023
JJJJ-MM-TT    = 2023-01-03
HH:MM:SS      = 18:21:24
HH:MM:SS,MS   = 18:21:24,27
Timestamp     = 03.01.2023 18:21:24,27
Datum/Zeit    = Dienstag, 03.Januar 2023, 18:21:24
absolute Zeit = 738.522 Tage == 6.380.836.688.427 HS
12.10.06 06:21:24,27
294:21:24,27
06 Jahre 10 Monate 12 Tage, 06:21:24,27
6,865 Jahre / 82,381 Monate / 358,181 Wochen / 2.507,265 Tage / 60.174,357 h / 3.610.461,405 min / 216.627.684,27 s
i=4
vorher: 6.380.836.688.427
nachher:6.384.318.974.528
Wochentag     = Sonnabend
TT.MM.JJ      = 10.02.24
TT.MM.JJJJ    = 10.02.2024
JJJJ-MM-TT    = 2024-02-10
HH:MM:SS      = 19:22:25
HH:MM:SS,MS   = 19:22:25,28
Timestamp     = 10.02.2024 19:22:25,28
Datum/Zeit    = Sonnabend, 10.Februar 2024, 19:22:25
absolute Zeit = 738.925 Tage == 6.384.318.974.528 HS
19.11.07 07:22:25,28
463:22:25,28
07 Jahre 11 Monate 19 Tage, 07:22:25,28
7,969 Jahre / 95,624 Monate / 415,758 Wochen / 2.910,307 Tage / 69.847,374 h / 4.190.842,421 min / 251.450.545,28 s
nachher:6.388.208.811.236
Wochentag     = Dienstag
TT.MM.JJ      = 06.05.25
TT.MM.JJJJ    = 06.05.2025
JJJJ-MM-TT    = 2025-05-06
HH:MM:SS      = 00:28:32
HH:MM:SS,MS   = 00:28:32,36
Timestamp     = 06.05.2025 00:28:32,36
Datum/Zeit    = Dienstag, 06.Mai 2025, 00:28:32
absolute Zeit = 739.376 Tage == 6.388.208.811.236 HS
13.02.09 12:28:32,36
324:28:32,36
09 Jahre 02 Monate 13 Tage, 12:28:32,36
9,201 Jahre / 110,416 Monate / 480,074 Wochen / 3.360,520 Tage / 80.652,476 h / 4.839.148,539 min / 290.348.912,36 s
i=5
vorher: 6.388.208.811.236
nachher:6.391.691.097.337
Wochentag     = Sonnabend
TT.MM.JJ      = 13.06.26
TT.MM.JJJJ    = 13.06.2026
JJJJ-MM-TT    = 2026-06-13
HH:MM:SS      = 01:29:33
HH:MM:SS,MS   = 01:29:33,37
Timestamp     = 13.06.2026 01:29:33,37
Datum/Zeit    = Sonnabend, 13.Juni 2026, 01:29:33
absolute Zeit = 739.779 Tage == 6.391.691.097.337 HS
21.03.10 13:29:33,37
517:29:33,37
10 Jahre 03 Monate 21 Tage, 13:29:33,37
10,305 Jahre / 123,659 Monate / 537,652 Wochen / 3.763,562 Tage / 90.325,493 h / 5.419.529,556 min / 325.171.773,37 s
nachher:6.395.580.934.045
Wochentag     = Montag
TT.MM.JJ      = 06.09.27
TT.MM.JJJJ    = 06.09.2027
JJJJ-MM-TT    = 2027-09-06
HH:MM:SS      = 06:35:40
HH:MM:SS,MS   = 06:35:40,45
Timestamp     = 06.09.2027 06:35:40,45
Datum/Zeit    = Montag, 06.September 2027, 06:35:40
absolute Zeit = 740.229 Tage == 6.395.580.934.045 HS
14.06.11 18:35:40,45
354:35:40,45
11 Jahre 06 Monate 14 Tage, 18:35:40,45
11,538 Jahre / 138,452 Monate / 601,968 Wochen / 4.213,775 Tage / 101.130,595 h / 6.067.835,674 min / 364.070.140,45 s
i=6
vorher: 6.395.580.934.045
nachher:6.399.063.220.146
Wochentag     = Freitag
TT.MM.JJ      = 13.10.28
TT.MM.JJJJ    = 13.10.2028
JJJJ-MM-TT    = 2028-10-13
HH:MM:SS      = 07:36:41
HH:MM:SS,MS   = 07:36:41,46
Timestamp     = 13.10.2028 07:36:41,46
Datum/Zeit    = Freitag, 13.Oktober 2028, 07:36:41
absolute Zeit = 740.632 Tage == 6.399.063.220.146 HS
20.07.12 19:36:41,46
499:36:41,46
12 Jahre 07 Monate 20 Tage, 19:36:41,46
12,641 Jahre / 151,694 Monate / 659,545 Wochen / 4.616,817 Tage / 110.803,612 h / 6.648.216,691 min / 398.893.001,46 s
nachher:6.402.953.056.854
Wochentag     = Sonntag
TT.MM.JJ      = 06.01.30
TT.MM.JJJJ    = 06.01.2030
JJJJ-MM-TT    = 2030-01-06
HH:MM:SS      = 12:42:48
HH:MM:SS,MS   = 12:42:48,54
Timestamp     = 06.01.2030 12:42:48,54
Datum/Zeit    = Sonntag, 06.Januar 2030, 12:42:48
absolute Zeit = 741.082 Tage == 6.402.953.056.854 HS
15.10.13 00:42:48,54
360:42:48,54
13 Jahre 10 Monate 15 Tage, 00:42:48,54
13,874 Jahre / 166,487 Monate / 723,861 Wochen / 5.067,030 Tage / 121.608,713 h / 7.296.522,809 min / 437.791.368,54 s
i=7
vorher: 6.402.953.056.854
nachher:6.406.435.342.955
Wochentag     = Donnerstag
TT.MM.JJ      = 13.02.31
TT.MM.JJJJ    = 13.02.2031
JJJJ-MM-TT    = 2031-02-13
HH:MM:SS      = 13:43:49
HH:MM:SS,MS   = 13:43:49,55
Timestamp     = 13.02.2031 13:43:49,55
Datum/Zeit    = Donnerstag, 13.Februar 2031, 13:43:49
absolute Zeit = 741.485 Tage == 6.406.435.342.955 HS
22.11.14 01:43:49,55
529:43:49,55
14 Jahre 11 Monate 22 Tage, 01:43:49,55
14,977 Jahre / 179,730 Monate / 781,439 Wochen / 5.470,072 Tage / 131.281,730 h / 7.876.903,826 min / 472.614.229,55 s
nachher:6.410.325.179.663
Wochentag     = Sonnabend
TT.MM.JJ      = 08.05.32
TT.MM.JJJJ    = 08.05.2032
JJJJ-MM-TT    = 2032-05-08
HH:MM:SS      = 18:49:56
HH:MM:SS,MS   = 18:49:56,63
Timestamp     = 08.05.2032 18:49:56,63
Datum/Zeit    = Sonnabend, 08.Mai 2032, 18:49:56
absolute Zeit = 741.935 Tage == 6.410.325.179.663 HS
16.02.16 06:49:56,63
390:49:56,63
16 Jahre 02 Monate 16 Tage, 06:49:56,63
16,210 Jahre / 194,522 Monate / 845,755 Wochen / 5.920,285 Tage / 142.086,832 h / 8.525.209,944 min / 511.512.596,63 s
i=8
vorher: 6.410.325.179.663
nachher:6.413.807.465.764
Wochentag     = Mittwoch
TT.MM.JJ      = 15.06.33
TT.MM.JJJJ    = 15.06.2033
JJJJ-MM-TT    = 2033-06-15
HH:MM:SS      = 19:50:57
HH:MM:SS,MS   = 19:50:57,64
Timestamp     = 15.06.2033 19:50:57,64
Datum/Zeit    = Mittwoch, 15.Juni 2033, 19:50:57
absolute Zeit = 742.338 Tage == 6.413.807.465.764 HS
24.03.17 07:50:57,64
583:50:57,64
17 Jahre 03 Monate 24 Tage, 07:50:57,64
17,314 Jahre / 207,765 Monate / 903,332 Wochen / 6.323,327 Tage / 151.759,849 h / 9.105.590,961 min / 546.335.457,64 s
nachher:6.417.697.302.472
Wochentag     = Sonnabend
TT.MM.JJ      = 09.09.34
TT.MM.JJJJ    = 09.09.2034
JJJJ-MM-TT    = 2034-09-09
HH:MM:SS      = 00:57:04
HH:MM:SS,MS   = 00:57:04,72
Timestamp     = 09.09.2034 00:57:04,72
Datum/Zeit    = Sonnabend, 09.September 2034, 00:57:04
absolute Zeit = 742.789 Tage == 6.417.697.302.472 HS
17.06.18 12:57:04,72
420:57:04,72
18 Jahre 06 Monate 17 Tage, 12:57:04,72
18,546 Jahre / 222,558 Monate / 967,649 Wochen / 6.773,540 Tage / 162.564,951 h / 9.753.897,079 min / 585.233.824,72 s
i=9
vorher: 6.417.697.302.472
nachher:6.421.179.588.573
Wochentag     = Mittwoch
TT.MM.JJ      = 17.10.35
TT.MM.JJJJ    = 17.10.2035
JJJJ-MM-TT    = 2035-10-17
HH:MM:SS      = 01:58:05
HH:MM:SS,MS   = 01:58:05,73
Timestamp     = 17.10.2035 01:58:05,73
Datum/Zeit    = Mittwoch, 17.Oktober 2035, 01:58:05
absolute Zeit = 743.192 Tage == 6.421.179.588.573 HS
24.07.19 13:58:05,73
589:58:05,73
19 Jahre 07 Monate 24 Tage, 13:58:05,73
19,650 Jahre / 235,800 Monate / 1.025,226 Wochen / 7.176,582 Tage / 172.237,968 h / 10.334.278,095 min / 620.056.685,73 s
nachher:6.425.069.425.281
Wochentag     = Freitag
TT.MM.JJ      = 09.01.37
TT.MM.JJJJ    = 09.01.2037
JJJJ-MM-TT    = 2037-01-09
HH:MM:SS      = 07:04:12
HH:MM:SS,MS   = 07:04:12,81
Timestamp     = 09.01.2037 07:04:12,81
Datum/Zeit    = Freitag, 09.Januar 2037, 07:04:12
absolute Zeit = 743.642 Tage == 6.425.069.425.281 HS
17.10.20 19:04:12,81
427:04:12,81
20 Jahre 10 Monate 17 Tage, 19:04:12,81
20,883 Jahre / 250,593 Monate / 1.089,542 Wochen / 7.626,795 Tage / 183.043,070 h / 10.982.584,213 min / 658.955.052,81 s
i=10
vorher: 6.425.069.425.281
nachher:6.428.551.711.382
Wochentag     = Dienstag
TT.MM.JJ      = 16.02.38
TT.MM.JJJJ    = 16.02.2038
JJJJ-MM-TT    = 2038-02-16
HH:MM:SS      = 08:05:13
HH:MM:SS,MS   = 08:05:13,82
Timestamp     = 16.02.2038 08:05:13,82
Datum/Zeit    = Dienstag, 16.Februar 2038, 08:05:13
absolute Zeit = 744.045 Tage == 6.428.551.711.382 HS
24.11.21 20:05:13,82
596:05:13,82
21 Jahre 11 Monate 24 Tage, 20:05:13,82
21,986 Jahre / 263,836 Monate / 1.147,120 Wochen / 8.029,837 Tage / 192.716,087 h / 11.562.965,230 min / 693.777.913,82 s
nachher:6.432.441.548.090
Wochentag     = Donnerstag
TT.MM.JJ      = 12.05.39
TT.MM.JJJJ    = 12.05.2039
JJJJ-MM-TT    = 2039-05-12
HH:MM:SS      = 13:11:20
HH:MM:SS,MS   = 13:11:20,90
Timestamp     = 12.05.2039 13:11:20,90
Datum/Zeit    = Donnerstag, 12.Mai 2039, 13:11:20
absolute Zeit = 744.495 Tage == 6.432.441.548.090 HS
20.02.23 01:11:20,90
481:11:20,90
23 Jahre 02 Monate 20 Tage, 01:11:20,90
23,219 Jahre / 278,628 Monate / 1.211,436 Wochen / 8.480,050 Tage / 203.521,189 h / 12.211.271,348 min / 732.676.280,90 s
i=11
vorher: 6.432.441.548.090
nachher:6.435.923.834.191
Wochentag     = Montag
TT.MM.JJ      = 18.06.40
TT.MM.JJJJ    = 18.06.2040
JJJJ-MM-TT    = 2040-06-18
HH:MM:SS      = 14:12:21
HH:MM:SS,MS   = 14:12:21,91
Timestamp     = 18.06.2040 14:12:21,91
Datum/Zeit    = Montag, 18.Juni 2040, 14:12:21
absolute Zeit = 744.898 Tage == 6.435.923.834.191 HS
27.03.24 02:12:21,91
650:12:21,91
24 Jahre 03 Monate 27 Tage, 02:12:21,91
24,323 Jahre / 291,871 Monate / 1.269,013 Wochen / 8.883,092 Tage / 213.194,206 h / 12.791.652,365 min / 767.499.141,91 s
nachher:6.439.813.670.899
Wochentag     = Mittwoch
TT.MM.JJ      = 11.09.41
TT.MM.JJJJ    = 11.09.2041
JJJJ-MM-TT    = 2041-09-11
HH:MM:SS      = 19:18:28
HH:MM:SS,MS   = 19:18:28,99
Timestamp     = 11.09.2041 19:18:28,99
Datum/Zeit    = Mittwoch, 11.September 2041, 19:18:28
absolute Zeit = 745.348 Tage == 6.439.813.670.899 HS
20.06.25 07:18:28,99
487:18:28,99
25 Jahre 06 Monate 20 Tage, 07:18:28,99
25,555 Jahre / 306,664 Monate / 1.333,329 Wochen / 9.333,305 Tage / 223.999,308 h / 13.439.958,483 min / 806.397.508,99 s
i=12
vorher: 6.439.813.670.899
nachher:6.443.295.957.000
Wochentag     = Sonntag
TT.MM.JJ      = 19.10.42
TT.MM.JJJJ    = 19.10.2042
JJJJ-MM-TT    = 2042-10-19
HH:MM:SS      = 20:19:30
HH:MM:SS,MS   = 20:19:30,00
Timestamp     = 19.10.2042 20:19:30,00
Datum/Zeit    = Sonntag, 19.Oktober 2042, 20:19:30
absolute Zeit = 745.751 Tage == 6.443.295.957.000 HS
27.07.26 08:19:30,00
656:19:30,00
26 Jahre 07 Monate 27 Tage, 08:19:30,00
26,659 Jahre / 319,906 Monate / 1.390,907 Wochen / 9.736,347 Tage / 233.672,325 h / 14.020.339,500 min / 841.220.370,00 s
nachher:6.447.185.793.708
Wochentag     = Mittwoch
TT.MM.JJ      = 13.01.44
TT.MM.JJJJ    = 13.01.2044
JJJJ-MM-TT    = 2044-01-13
HH:MM:SS      = 01:25:37
HH:MM:SS,MS   = 01:25:37,08
Timestamp     = 13.01.2044 01:25:37,08
Datum/Zeit    = Mittwoch, 13.Januar 2044, 01:25:37
absolute Zeit = 746.202 Tage == 6.447.185.793.708 HS
21.10.27 13:25:37,08
517:25:37,08
27 Jahre 10 Monate 21 Tage, 13:25:37,08
27,892 Jahre / 334,699 Monate / 1.455,223 Wochen / 10.186,559 Tage / 244.477,427 h / 14.668.645,618 min / 880.118.737,08 s
i=13
vorher: 6.447.185.793.708
nachher:6.450.668.079.809
Wochentag     = Sonntag
TT.MM.JJ      = 19.02.45
TT.MM.JJJJ    = 19.02.2045
JJJJ-MM-TT    = 2045-02-19
HH:MM:SS      = 02:26:38
HH:MM:SS,MS   = 02:26:38,09
Timestamp     = 19.02.2045 02:26:38,09
Datum/Zeit    = Sonntag, 19.Februar 2045, 02:26:38
absolute Zeit = 746.605 Tage == 6.450.668.079.809 HS
27.11.28 14:26:38,09
662:26:38,09
28 Jahre 11 Monate 27 Tage, 14:26:38,09
28,995 Jahre / 347,942 Monate / 1.512,800 Wochen / 10.589,602 Tage / 254.150,444 h / 15.249.026,635 min / 914.941.598,09 s
nachher:6.454.557.916.517
Wochentag     = Dienstag
TT.MM.JJ      = 15.05.46
TT.MM.JJJJ    = 15.05.2046
JJJJ-MM-TT    = 2046-05-15
HH:MM:SS      = 07:32:45
HH:MM:SS,MS   = 07:32:45,17
Timestamp     = 15.05.2046 07:32:45,17
Datum/Zeit    = Dienstag, 15.Mai 2046, 07:32:45
absolute Zeit = 747.055 Tage == 6.454.557.916.517 HS
22.02.30 19:32:45,17
547:32:45,17
30 Jahre 02 Monate 22 Tage, 19:32:45,17
30,228 Jahre / 362,734 Monate / 1.577,116 Wochen / 11.039,814 Tage / 264.955,546 h / 15.897.332,753 min / 953.839.965,17 s
i=14
vorher: 6.454.557.916.517
nachher:6.458.040.202.618
Wochentag     = Sonnabend
TT.MM.JJ      = 22.06.47
TT.MM.JJJJ    = 22.06.2047
JJJJ-MM-TT    = 2047-06-22
HH:MM:SS      = 08:33:46
HH:MM:SS,MS   = 08:33:46,18
Timestamp     = 22.06.2047 08:33:46,18
Datum/Zeit    = Sonnabend, 22.Juni 2047, 08:33:46
absolute Zeit = 747.458 Tage == 6.458.040.202.618 HS
30.03.31 20:33:46,18
740:33:46,18
31 Jahre 03 Monate 30 Tage, 20:33:46,18
31,331 Jahre / 375,977 Monate / 1.634,694 Wochen / 11.442,857 Tage / 274.628,563 h / 16.477.713,770 min / 988.662.826,18 s
nachher:6.461.930.039.326
Wochentag     = Montag
TT.MM.JJ      = 14.09.48
TT.MM.JJJJ    = 14.09.2048
JJJJ-MM-TT    = 2048-09-14
HH:MM:SS      = 13:39:53
HH:MM:SS,MS   = 13:39:53,26
Timestamp     = 14.09.2048 13:39:53,26
Datum/Zeit    = Montag, 14.September 2048, 13:39:53
absolute Zeit = 747.908 Tage == 6.461.930.039.326 HS
23.06.32 01:39:53,26
553:39:53,26
32 Jahre 06 Monate 23 Tage, 01:39:53,26
32,564 Jahre / 390,769 Monate / 1.699,010 Wochen / 11.893,069 Tage / 285.433,665 h / 17.126.019,888 min / 1.027.561.193,26 s
i=15
vorher: 6.461.930.039.326
nachher:6.465.412.325.427
Wochentag     = Freitag
TT.MM.JJ      = 22.10.49
TT.MM.JJJJ    = 22.10.2049
JJJJ-MM-TT    = 2049-10-22
HH:MM:SS      = 14:40:54
HH:MM:SS,MS   = 14:40:54,27
Timestamp     = 22.10.2049 14:40:54,27
Datum/Zeit    = Freitag, 22.Oktober 2049, 14:40:54
absolute Zeit = 748.311 Tage == 6.465.412.325.427 HS
00.08.33 02:40:54,27
02:40:54,27
33 Jahre 08 Monate 00 Tage, 02:40:54,27
33,668 Jahre / 404,012 Monate / 1.756,587 Wochen / 12.296,112 Tage / 295.106,682 h / 17.706.400,905 min / 1.062.384.054,27 s
nachher:6.469.302.162.135
Wochentag     = Sonntag
TT.MM.JJ      = 15.01.51
TT.MM.JJJJ    = 15.01.2051
JJJJ-MM-TT    = 2051-01-15
HH:MM:SS      = 19:47:01
HH:MM:SS,MS   = 19:47:01,35
Timestamp     = 15.01.2051 19:47:01,35
Datum/Zeit    = Sonntag, 15.Januar 2051, 19:47:01
absolute Zeit = 748.761 Tage == 6.469.302.162.135 HS
24.10.34 07:47:01,35
583:47:01,35
34 Jahre 10 Monate 24 Tage, 07:47:01,35
34,900 Jahre / 418,805 Monate / 1.820,903 Wochen / 12.746,324 Tage / 305.911,784 h / 18.354.707,022 min / 1.101.282.421,35 s
i=16
vorher: 6.469.302.162.135
nachher:6.472.784.448.236
Wochentag     = Donnerstag
TT.MM.JJ      = 22.02.52
TT.MM.JJJJ    = 22.02.2052
JJJJ-MM-TT    = 2052-02-22
HH:MM:SS      = 20:48:02
HH:MM:SS,MS   = 20:48:02,36
Timestamp     = 22.02.2052 20:48:02,36
Datum/Zeit    = Donnerstag, 22.Februar 2052, 20:48:02
absolute Zeit = 749.164 Tage == 6.472.784.448.236 HS
00.00.36 08:48:02,36
08:48:02,36
36 Jahre 00 Monate 00 Tage, 08:48:02,36
36,004 Jahre / 432,048 Monate / 1.878,481 Wochen / 13.149,367 Tage / 315.584,801 h / 18.935.088,039 min / 1.136.105.282,36 s
nachher:6.476.674.284.944
Wochentag     = Sonntag
TT.MM.JJ      = 18.05.53
TT.MM.JJJJ    = 18.05.2053
JJJJ-MM-TT    = 2053-05-18
HH:MM:SS      = 01:54:09
HH:MM:SS,MS   = 01:54:09,44
Timestamp     = 18.05.2053 01:54:09,44
Datum/Zeit    = Sonntag, 18.Mai 2053, 01:54:09
absolute Zeit = 749.615 Tage == 6.476.674.284.944 HS
25.02.37 13:54:09,44
613:54:09,44
37 Jahre 02 Monate 25 Tage, 13:54:09,44
37,237 Jahre / 446,840 Monate / 1.942,797 Wochen / 13.599,579 Tage / 326.389,903 h / 19.583.394,157 min / 1.175.003.649,44 s
i=17
vorher: 6.476.674.284.944
nachher:6.480.156.571.045
Wochentag     = Donnerstag
TT.MM.JJ      = 25.06.54
TT.MM.JJJJ    = 25.06.2054
JJJJ-MM-TT    = 2054-06-25
HH:MM:SS      = 02:55:10
HH:MM:SS,MS   = 02:55:10,45
Timestamp     = 25.06.2054 02:55:10,45
Datum/Zeit    = Donnerstag, 25.Juni 2054, 02:55:10
absolute Zeit = 750.018 Tage == 6.480.156.571.045 HS
02.04.38 14:55:10,45
62:55:10,45
38 Jahre 04 Monate 02 Tage, 14:55:10,45
38,340 Jahre / 460,083 Monate / 2.000,375 Wochen / 14.002,622 Tage / 336.062,920 h / 20.163.775,174 min / 1.209.826.510,45 s
nachher:6.484.046.407.753
Wochentag     = Sonnabend
TT.MM.JJ      = 18.09.55
TT.MM.JJJJ    = 18.09.2055
JJJJ-MM-TT    = 2055-09-18
HH:MM:SS      = 08:01:17
HH:MM:SS,MS   = 08:01:17,53
Timestamp     = 18.09.2055 08:01:17,53
Datum/Zeit    = Sonnabend, 18.September 2055, 08:01:17
absolute Zeit = 750.468 Tage == 6.484.046.407.753 HS
26.06.39 20:01:17,53
644:01:17,53
39 Jahre 06 Monate 26 Tage, 20:01:17,53
39,573 Jahre / 474,875 Monate / 2.064,691 Wochen / 14.452,834 Tage / 346.868,022 h / 20.812.081,292 min / 1.248.724.877,53 s
i=18
vorher: 6.484.046.407.753
nachher:6.487.528.693.854
Wochentag     = Mittwoch
TT.MM.JJ      = 25.10.56
TT.MM.JJJJ    = 25.10.2056
JJJJ-MM-TT    = 2056-10-25
HH:MM:SS      = 09:02:18
HH:MM:SS,MS   = 09:02:18,54
Timestamp     = 25.10.2056 09:02:18,54
Datum/Zeit    = Mittwoch, 25.Oktober 2056, 09:02:18
absolute Zeit = 750.871 Tage == 6.487.528.693.854 HS
02.08.40 21:02:18,54
69:02:18,54
40 Jahre 08 Monate 02 Tage, 21:02:18,54
40,677 Jahre / 488,118 Monate / 2.122,268 Wochen / 14.855,877 Tage / 356.541,038 h / 21.392.462,309 min / 1.283.547.738,54 s
nachher:6.491.418.530.562
Wochentag     = Freitag
TT.MM.JJ      = 18.01.58
TT.MM.JJJJ    = 18.01.2058
JJJJ-MM-TT    = 2058-01-18
HH:MM:SS      = 14:08:25
HH:MM:SS,MS   = 14:08:25,62
Timestamp     = 18.01.2058 14:08:25,62
Datum/Zeit    = Freitag, 18.Januar 2058, 14:08:25
absolute Zeit = 751.321 Tage == 6.491.418.530.562 HS
27.10.41 02:08:25,62
650:08:25,62
41 Jahre 10 Monate 27 Tage, 02:08:25,62
41,909 Jahre / 502,911 Monate / 2.186,584 Wochen / 15.306,089 Tage / 367.346,140 h / 22.040.768,427 min / 1.322.446.105,62 s
i=19
vorher: 6.491.418.530.562
nachher:6.494.900.816.663
Wochentag     = Dienstag
TT.MM.JJ      = 25.02.59
TT.MM.JJJJ    = 25.02.2059
JJJJ-MM-TT    = 2059-02-25
HH:MM:SS      = 15:09:26
HH:MM:SS,MS   = 15:09:26,63
Timestamp     = 25.02.2059 15:09:26,63
Datum/Zeit    = Dienstag, 25.Februar 2059, 15:09:26
absolute Zeit = 751.724 Tage == 6.494.900.816.663 HS
03.00.43 03:09:26,63
75:09:26,63
43 Jahre 00 Monate 03 Tage, 03:09:26,63
43,013 Jahre / 516,153 Monate / 2.244,162 Wochen / 15.709,132 Tage / 377.019,157 h / 22.621.149,444 min / 1.357.268.966,63 s
nachher:6.498.790.653.371
Wochentag     = Donnerstag
TT.MM.JJ      = 20.05.60
TT.MM.JJJJ    = 20.05.2060
JJJJ-MM-TT    = 2060-05-20
HH:MM:SS      = 20:15:33
HH:MM:SS,MS   = 20:15:33,71
Timestamp     = 20.05.2060 20:15:33,71
Datum/Zeit    = Donnerstag, 20.Mai 2060, 20:15:33
absolute Zeit = 752.174 Tage == 6.498.790.653.371 HS
28.02.44 08:15:33,71
680:15:33,71
44 Jahre 02 Monate 28 Tage, 08:15:33,71
44,246 Jahre / 530,946 Monate / 2.308,478 Wochen / 16.159,344 Tage / 387.824,259 h / 23.269.455,562 min / 1.396.167.333,71 s
i=20
vorher: 6.498.790.653.371
nachher:6.502.272.939.472
Wochentag     = Montag
TT.MM.JJ      = 27.06.61
TT.MM.JJJJ    = 27.06.2061
JJJJ-MM-TT    = 2061-06-27
HH:MM:SS      = 21:16:34
HH:MM:SS,MS   = 21:16:34,72
Timestamp     = 27.06.2061 21:16:34,72
Datum/Zeit    = Montag, 27.Juni 2061, 21:16:34
absolute Zeit = 752.577 Tage == 6.502.272.939.472 HS
05.04.45 09:16:34,72
129:16:34,72
45 Jahre 04 Monate 05 Tage, 09:16:34,72
45,349 Jahre / 544,189 Monate / 2.366,055 Wochen / 16.562,387 Tage / 397.497,276 h / 23.849.836,579 min / 1.430.990.194,72 s
nachher:6.506.162.776.180
Wochentag     = Donnerstag
TT.MM.JJ      = 21.09.62
TT.MM.JJJJ    = 21.09.2062
JJJJ-MM-TT    = 2062-09-21
HH:MM:SS      = 02:22:41
HH:MM:SS,MS   = 02:22:41,80
Timestamp     = 21.09.2062 02:22:41,80
Datum/Zeit    = Donnerstag, 21.September 2062, 02:22:41
absolute Zeit = 753.028 Tage == 6.506.162.776.180 HS
29.06.46 14:22:41,80
710:22:41,80
46 Jahre 06 Monate 29 Tage, 14:22:41,80
46,582 Jahre / 558,981 Monate / 2.430,371 Wochen / 17.012,599 Tage / 408.302,378 h / 24.498.142,697 min / 1.469.888.561,80 s
i=21
vorher: 6.506.162.776.180
nachher:6.509.645.062.281
Wochentag     = Montag
TT.MM.JJ      = 29.10.63
TT.MM.JJJJ    = 29.10.2063
JJJJ-MM-TT    = 2063-10-29
HH:MM:SS      = 03:23:42
HH:MM:SS,MS   = 03:23:42,81
Timestamp     = 29.10.2063 03:23:42,81
Datum/Zeit    = Montag, 29.Oktober 2063, 03:23:42
absolute Zeit = 753.431 Tage == 6.509.645.062.281 HS
06.08.47 15:23:42,81
159:23:42,81
47 Jahre 08 Monate 06 Tage, 15:23:42,81
47,685 Jahre / 572,224 Monate / 2.487,949 Wochen / 17.415,641 Tage / 417.975,395 h / 25.078.523,714 min / 1.504.711.422,81 s
nachher:6.513.534.898.989
Wochentag     = Mittwoch
TT.MM.JJ      = 21.01.65
TT.MM.JJJJ    = 21.01.2065
JJJJ-MM-TT    = 2065-01-21
HH:MM:SS      = 08:29:49
HH:MM:SS,MS   = 08:29:49,89
Timestamp     = 21.01.2065 08:29:49,89
Datum/Zeit    = Mittwoch, 21.Januar 2065, 08:29:49
absolute Zeit = 753.881 Tage == 6.513.534.898.989 HS
29.10.48 20:29:49,89
716:29:49,89
48 Jahre 10 Monate 29 Tage, 20:29:49,89
48,918 Jahre / 587,017 Monate / 2.552,265 Wochen / 17.865,854 Tage / 428.780,497 h / 25.726.829,832 min / 1.543.609.789,89 s
i=22
vorher: 6.513.534.898.989
nachher:6.517.017.185.090
Wochentag     = Sonntag
TT.MM.JJ      = 28.02.66
TT.MM.JJJJ    = 28.02.2066
JJJJ-MM-TT    = 2066-02-28
HH:MM:SS      = 09:30:50
HH:MM:SS,MS   = 09:30:50,90
Timestamp     = 28.02.2066 09:30:50,90
Datum/Zeit    = Sonntag, 28.Februar 2066, 09:30:50
absolute Zeit = 754.284 Tage == 6.517.017.185.090 HS
05.00.50 21:30:50,90
141:30:50,90
50 Jahre 00 Monate 05 Tage, 21:30:50,90
50,022 Jahre / 600,259 Monate / 2.609,842 Wochen / 18.268,896 Tage / 438.453,514 h / 26.307.210,848 min / 1.578.432.650,90 s
nachher:6.520.907.021.798
Wochentag     = Dienstag
TT.MM.JJ      = 24.05.67
TT.MM.JJJJ    = 24.05.2067
JJJJ-MM-TT    = 2067-05-24
HH:MM:SS      = 14:36:57
HH:MM:SS,MS   = 14:36:57,98
Timestamp     = 24.05.2067 14:36:57,98
Datum/Zeit    = Dienstag, 24.Mai 2067, 14:36:57
absolute Zeit = 754.734 Tage == 6.520.907.021.798 HS
02.03.51 02:36:57,98
50:36:57,98
51 Jahre 03 Monate 02 Tage, 02:36:57,98
51,254 Jahre / 615,052 Monate / 2.674,158 Wochen / 18.719,109 Tage / 449.258,616 h / 26.955.516,966 min / 1.617.331.017,98 s
i=23
vorher: 6.520.907.021.798
nachher:6.524.389.307.899
Wochentag     = Sonnabend
TT.MM.JJ      = 30.06.68
TT.MM.JJJJ    = 30.06.2068
JJJJ-MM-TT    = 2068-06-30
HH:MM:SS      = 15:37:58
HH:MM:SS,MS   = 15:37:58,99
Timestamp     = 30.06.2068 15:37:58,99
Datum/Zeit    = Sonnabend, 30.Juni 2068, 15:37:58
absolute Zeit = 755.137 Tage == 6.524.389.307.899 HS
08.04.52 03:37:58,99
195:37:58,99
52 Jahre 04 Monate 08 Tage, 03:37:58,99
52,358 Jahre / 628,295 Monate / 2.731,736 Wochen / 19.122,151 Tage / 458.931,633 h / 27.535.897,983 min / 1.652.153.878,99 s
nachher:6.528.279.144.607
Wochentag     = Montag
TT.MM.JJ      = 23.09.69
TT.MM.JJJJ    = 23.09.2069
JJJJ-MM-TT    = 2069-09-23
HH:MM:SS      = 20:44:06
HH:MM:SS,MS   = 20:44:06,07
Timestamp     = 23.09.2069 20:44:06,07
Datum/Zeit    = Montag, 23.September 2069, 20:44:06
absolute Zeit = 755.587 Tage == 6.528.279.144.607 HS
01.07.53 08:44:06,07
32:44:06,07
53 Jahre 07 Monate 01 Tage, 08:44:06,07
53,591 Jahre / 643,087 Monate / 2.796,052 Wochen / 19.572,364 Tage / 469.736,735 h / 28.184.204,101 min / 1.691.052.246,07 s
i=24
vorher: 6.528.279.144.607
nachher:6.531.761.430.708
Wochentag     = Freitag
TT.MM.JJ      = 31.10.70
TT.MM.JJJJ    = 31.10.2070
JJJJ-MM-TT    = 2070-10-31
HH:MM:SS      = 21:45:07
HH:MM:SS,MS   = 21:45:07,08
Timestamp     = 31.10.2070 21:45:07,08
Datum/Zeit    = Freitag, 31.Oktober 2070, 21:45:07
absolute Zeit = 755.990 Tage == 6.531.761.430.708 HS
09.08.54 09:45:07,08
225:45:07,08
54 Jahre 08 Monate 09 Tage, 09:45:07,08
54,694 Jahre / 656,330 Monate / 2.853,629 Wochen / 19.975,406 Tage / 479.409,752 h / 28.764.585,118 min / 1.725.875.107,08 s
nachher:6.535.651.267.416
Wochentag     = Montag
TT.MM.JJ      = 25.01.72
TT.MM.JJJJ    = 25.01.2072
JJJJ-MM-TT    = 2072-01-25
HH:MM:SS      = 02:51:14
HH:MM:SS,MS   = 02:51:14,16
Timestamp     = 25.01.2072 02:51:14,16
Datum/Zeit    = Montag, 25.Januar 2072, 02:51:14
absolute Zeit = 756.441 Tage == 6.535.651.267.416 HS
02.11.55 14:51:14,16
62:51:14,16
55 Jahre 11 Monate 02 Tage, 14:51:14,16
55,927 Jahre / 671,123 Monate / 2.917,946 Wochen / 20.425,619 Tage / 490.214,854 h / 29.412.891,236 min / 1.764.773.474,16 s
i=25
vorher: 6.535.651.267.416
nachher:6.539.133.553.517
Wochentag     = Freitag
TT.MM.JJ      = 03.03.73
TT.MM.JJJJ    = 03.03.2073
JJJJ-MM-TT    = 2073-03-03
HH:MM:SS      = 03:52:15
HH:MM:SS,MS   = 03:52:15,17
Timestamp     = 03.03.2073 03:52:15,17
Datum/Zeit    = Freitag, 03.M„rz 2073, 03:52:15
absolute Zeit = 756.844 Tage == 6.539.133.553.517 HS
09.00.57 15:52:15,17
231:52:15,17
57 Jahre 00 Monate 09 Tage, 15:52:15,17
57,030 Jahre / 684,365 Monate / 2.975,523 Wochen / 20.828,661 Tage / 499.887,871 h / 29.993.272,253 min / 1.799.596.335,17 s
nachher:6.543.023.390.225
Wochentag     = Sonntag
TT.MM.JJ      = 27.05.74
TT.MM.JJJJ    = 27.05.2074
JJJJ-MM-TT    = 2074-05-27
HH:MM:SS      = 08:58:22
HH:MM:SS,MS   = 08:58:22,25
Timestamp     = 27.05.2074 08:58:22,25
Datum/Zeit    = Sonntag, 27.Mai 2074, 08:58:22
absolute Zeit = 757.294 Tage == 6.543.023.390.225 HS
04.03.58 20:58:22,25
116:58:22,25
58 Jahre 03 Monate 04 Tage, 20:58:22,25
58,263 Jahre / 699,158 Monate / 3.039,839 Wochen / 21.278,874 Tage / 510.692,973 h / 30.641.578,371 min / 1.838.494.702,25 s
i=26
vorher: 6.543.023.390.225
nachher:6.546.505.676.326
Wochentag     = Donnerstag
TT.MM.JJ      = 04.07.75
TT.MM.JJJJ    = 04.07.2075
JJJJ-MM-TT    = 2075-07-04
HH:MM:SS      = 09:59:23
HH:MM:SS,MS   = 09:59:23,26
Timestamp     = 04.07.2075 09:59:23,26
Datum/Zeit    = Donnerstag, 04.Juli 2075, 09:59:23
absolute Zeit = 757.697 Tage == 6.546.505.676.326 HS
11.04.59 21:59:23,26
285:59:23,26
59 Jahre 04 Monate 11 Tage, 21:59:23,26
59,367 Jahre / 712,401 Monate / 3.097,417 Wochen / 21.681,916 Tage / 520.365,990 h / 31.221.959,388 min / 1.873.317.563,26 s
nachher:6.550.395.513.034
Wochentag     = Sonnabend
TT.MM.JJ      = 26.09.76
TT.MM.JJJJ    = 26.09.2076
JJJJ-MM-TT    = 2076-09-26
HH:MM:SS      = 15:05:30
HH:MM:SS,MS   = 15:05:30,34
Timestamp     = 26.09.2076 15:05:30,34
Datum/Zeit    = Sonnabend, 26.September 2076, 15:05:30
absolute Zeit = 758.147 Tage == 6.550.395.513.034 HS
04.07.60 03:05:30,34
99:05:30,34
60 Jahre 07 Monate 04 Tage, 03:05:30,34
60,599 Jahre / 727,193 Monate / 3.161,733 Wochen / 22.132,129 Tage / 531.171,092 h / 31.870.265,506 min / 1.912.215.930,34 s
i=27
vorher: 6.550.395.513.034
nachher:6.553.877.799.135
Wochentag     = Mittwoch
TT.MM.JJ      = 03.11.77
TT.MM.JJJJ    = 03.11.2077
JJJJ-MM-TT    = 2077-11-03
HH:MM:SS      = 16:06:31
HH:MM:SS,MS   = 16:06:31,35
Timestamp     = 03.11.2077 16:06:31,35
Datum/Zeit    = Mittwoch, 03.November 2077, 16:06:31
absolute Zeit = 758.550 Tage == 6.553.877.799.135 HS
12.08.61 04:06:31,35
292:06:31,35
61 Jahre 08 Monate 12 Tage, 04:06:31,35
61,703 Jahre / 740,436 Monate / 3.219,310 Wochen / 22.535,171 Tage / 540.844,109 h / 32.450.646,522 min / 1.947.038.791,35 s
nachher:6.557.767.635.843
Wochentag     = Freitag
TT.MM.JJ      = 27.01.79
TT.MM.JJJJ    = 27.01.2079
JJJJ-MM-TT    = 2079-01-27
HH:MM:SS      = 21:12:38
HH:MM:SS,MS   = 21:12:38,43
Timestamp     = 27.01.2079 21:12:38,43
Datum/Zeit    = Freitag, 27.Januar 2079, 21:12:38
absolute Zeit = 759.000 Tage == 6.557.767.635.843 HS
05.11.62 09:12:38,43
129:12:38,43
62 Jahre 11 Monate 05 Tage, 09:12:38,43
62,936 Jahre / 755,229 Monate / 3.283,626 Wochen / 22.985,384 Tage / 551.649,211 h / 33.098.952,641 min / 1.985.937.158,43 s
i=28
vorher: 6.557.767.635.843
nachher:6.561.249.921.944
Wochentag     = Dienstag
TT.MM.JJ      = 05.03.80
TT.MM.JJJJ    = 05.03.2080
JJJJ-MM-TT    = 2080-03-05
HH:MM:SS      = 22:13:39
HH:MM:SS,MS   = 22:13:39,44
Timestamp     = 05.03.2080 22:13:39,44
Datum/Zeit    = Dienstag, 05.M„rz 2080, 22:13:39
absolute Zeit = 759.403 Tage == 6.561.249.921.944 HS
12.00.64 10:13:39,44
298:13:39,44
64 Jahre 00 Monate 12 Tage, 10:13:39,44
64,039 Jahre / 768,471 Monate / 3.341,204 Wochen / 23.388,426 Tage / 561.322,228 h / 33.679.333,657 min / 2.020.760.019,44 s
nachher:6.565.139.758.652
Wochentag     = Freitag
TT.MM.JJ      = 30.05.81
TT.MM.JJJJ    = 30.05.2081
JJJJ-MM-TT    = 2081-05-30
HH:MM:SS      = 03:19:46
HH:MM:SS,MS   = 03:19:46,52
Timestamp     = 30.05.2081 03:19:46,52
Datum/Zeit    = Freitag, 30.Mai 2081, 03:19:46
absolute Zeit = 759.854 Tage == 6.565.139.758.652 HS
07.03.65 15:19:46,52
183:19:46,52
65 Jahre 03 Monate 07 Tage, 15:19:46,52
65,272 Jahre / 783,264 Monate / 3.405,520 Wochen / 23.838,639 Tage / 572.127,330 h / 34.327.639,775 min / 2.059.658.386,52 s
i=29
vorher: 6.565.139.758.652
nachher:6.568.622.044.753
Wochentag     = Dienstag
TT.MM.JJ      = 07.07.82
TT.MM.JJJJ    = 07.07.2082
JJJJ-MM-TT    = 2082-07-07
HH:MM:SS      = 04:20:47
HH:MM:SS,MS   = 04:20:47,53
Timestamp     = 07.07.2082 04:20:47,53
Datum/Zeit    = Dienstag, 07.Juli 2082, 04:20:47
absolute Zeit = 760.257 Tage == 6.568.622.044.753 HS
14.04.66 16:20:47,53
352:20:47,53
66 Jahre 04 Monate 14 Tage, 16:20:47,53
66,376 Jahre / 796,507 Monate / 3.463,097 Wochen / 24.241,681 Tage / 581.800,347 h / 34.908.020,792 min / 2.094.481.247,53 s
nachher:6.572.511.881.461
Wochentag     = Donnerstag
TT.MM.JJ      = 30.09.83
TT.MM.JJJJ    = 30.09.2083
JJJJ-MM-TT    = 2083-09-30
HH:MM:SS      = 09:26:54
HH:MM:SS,MS   = 09:26:54,61
Timestamp     = 30.09.2083 09:26:54,61
Datum/Zeit    = Donnerstag, 30.September 2083, 09:26:54
absolute Zeit = 760.707 Tage == 6.572.511.881.461 HS
07.07.67 21:26:54,61
189:26:54,61
67 Jahre 07 Monate 07 Tage, 21:26:54,61
67,608 Jahre / 811,299 Monate / 3.527,413 Wochen / 24.691,894 Tage / 592.605,449 h / 35.556.326,910 min / 2.133.379.614,61 s
i=30
vorher: 6.572.511.881.461
nachher:6.575.994.167.562
Wochentag     = Montag
TT.MM.JJ      = 06.11.84
TT.MM.JJJJ    = 06.11.2084
JJJJ-MM-TT    = 2084-11-06
HH:MM:SS      = 10:27:55
HH:MM:SS,MS   = 10:27:55,62
Timestamp     = 06.11.2084 10:27:55,62
Datum/Zeit    = Montag, 06.November 2084, 10:27:55
absolute Zeit = 761.110 Tage == 6.575.994.167.562 HS
14.08.68 22:27:55,62
358:27:55,62
68 Jahre 08 Monate 14 Tage, 22:27:55,62
68,712 Jahre / 824,542 Monate / 3.584,991 Wochen / 25.094,936 Tage / 602.278,465 h / 36.136.707,927 min / 2.168.202.475,62 s
nachher:6.579.884.004.270
Wochentag     = Mittwoch
TT.MM.JJ      = 30.01.86
TT.MM.JJJJ    = 30.01.2086
JJJJ-MM-TT    = 2086-01-30
HH:MM:SS      = 15:34:02
HH:MM:SS,MS   = 15:34:02,70
Timestamp     = 30.01.2086 15:34:02,70
Datum/Zeit    = Mittwoch, 30.Januar 2086, 15:34:02
absolute Zeit = 761.560 Tage == 6.579.884.004.270 HS
08.11.69 03:34:02,70
195:34:02,70
69 Jahre 11 Monate 08 Tage, 03:34:02,70
69,945 Jahre / 839,335 Monate / 3.649,307 Wochen / 25.545,149 Tage / 613.083,567 h / 36.785.014,045 min / 2.207.100.842,70 s
i=31
vorher: 6.579.884.004.270
nachher:6.583.366.290.371
Wochentag     = Sonntag
TT.MM.JJ      = 09.03.87
TT.MM.JJJJ    = 09.03.2087
JJJJ-MM-TT    = 2087-03-09
HH:MM:SS      = 16:35:03
HH:MM:SS,MS   = 16:35:03,71
Timestamp     = 09.03.2087 16:35:03,71
Datum/Zeit    = Sonntag, 09.M„rz 2087, 16:35:03
absolute Zeit = 761.963 Tage == 6.583.366.290.371 HS
16.00.71 04:35:03,71
388:35:03,71
71 Jahre 00 Monate 16 Tage, 04:35:03,71
71,048 Jahre / 852,577 Monate / 3.706,884 Wochen / 25.948,191 Tage / 622.756,584 h / 37.365.395,062 min / 2.241.923.703,71 s
nachher:6.587.256.127.079
Wochentag     = Dienstag
TT.MM.JJ      = 01.06.88
TT.MM.JJJJ    = 01.06.2088
JJJJ-MM-TT    = 2088-06-01
HH:MM:SS      = 21:41:10
HH:MM:SS,MS   = 21:41:10,79
Timestamp     = 01.06.2088 21:41:10,79
Datum/Zeit    = Dienstag, 01.Juni 2088, 21:41:10
absolute Zeit = 762.413 Tage == 6.587.256.127.079 HS
10.03.72 09:41:10,79
249:41:10,79
72 Jahre 03 Monate 10 Tage, 09:41:10,79
72,281 Jahre / 867,370 Monate / 3.771,201 Wochen / 26.398,404 Tage / 633.561,686 h / 38.013.701,180 min / 2.280.822.070,79 s
i=32
vorher: 6.587.256.127.079
nachher:6.590.738.413.180
Wochentag     = Sonnabend
TT.MM.JJ      = 09.07.89
TT.MM.JJJJ    = 09.07.2089
JJJJ-MM-TT    = 2089-07-09
HH:MM:SS      = 22:42:11
HH:MM:SS,MS   = 22:42:11,80
Timestamp     = 09.07.2089 22:42:11,80
Datum/Zeit    = Sonnabend, 09.Juli 2089, 22:42:11
absolute Zeit = 762.816 Tage == 6.590.738.413.180 HS
17.04.73 10:42:11,80
418:42:11,80
73 Jahre 04 Monate 17 Tage, 10:42:11,80
73,384 Jahre / 880,613 Monate / 3.828,778 Wochen / 26.801,446 Tage / 643.234,703 h / 38.594.082,197 min / 2.315.644.931,80 s
nachher:6.594.628.249.888
Wochentag     = Dienstag
TT.MM.JJ      = 03.10.90
TT.MM.JJJJ    = 03.10.2090
JJJJ-MM-TT    = 2090-10-03
HH:MM:SS      = 03:48:18
HH:MM:SS,MS   = 03:48:18,88
Timestamp     = 03.10.2090 03:48:18,88
Datum/Zeit    = Dienstag, 03.Oktober 2090, 03:48:18
absolute Zeit = 763.267 Tage == 6.594.628.249.888 HS
10.07.74 15:48:18,88
255:48:18,88
74 Jahre 07 Monate 10 Tage, 15:48:18,88
74,617 Jahre / 895,405 Monate / 3.893,094 Wochen / 27.251,659 Tage / 654.039,805 h / 39.242.388,315 min / 2.354.543.298,88 s
i=33
vorher: 6.594.628.249.888
nachher:6.598.110.535.989
Wochentag     = Sonnabend
TT.MM.JJ      = 10.11.91
TT.MM.JJJJ    = 10.11.2091
JJJJ-MM-TT    = 2091-11-10
HH:MM:SS      = 04:49:19
HH:MM:SS,MS   = 04:49:19,89
Timestamp     = 10.11.2091 04:49:19,89
Datum/Zeit    = Sonnabend, 10.November 2091, 04:49:19
absolute Zeit = 763.670 Tage == 6.598.110.535.989 HS
18.08.75 16:49:19,89
448:49:19,89
75 Jahre 08 Monate 18 Tage, 16:49:19,89
75,721 Jahre / 908,648 Monate / 3.950,672 Wochen / 27.654,701 Tage / 663.712,822 h / 39.822.769,332 min / 2.389.366.159,89 s
nachher:6.602.000.372.697
Wochentag     = Montag
TT.MM.JJ      = 02.02.93
TT.MM.JJJJ    = 02.02.2093
JJJJ-MM-TT    = 2093-02-02
HH:MM:SS      = 09:55:26
HH:MM:SS,MS   = 09:55:26,97
Timestamp     = 02.02.2093 09:55:26,97
Datum/Zeit    = Montag, 02.Februar 2093, 09:55:26
absolute Zeit = 764.120 Tage == 6.602.000.372.697 HS
10.11.76 21:55:26,97
261:55:26,97
76 Jahre 11 Monate 10 Tage, 21:55:26,97
76,953 Jahre / 923,441 Monate / 4.014,988 Wochen / 28.104,914 Tage / 674.517,924 h / 40.471.075,449 min / 2.428.264.526,97 s
i=34
vorher: 6.602.000.372.697
nachher:6.605.482.658.798
Wochentag     = Freitag
TT.MM.JJ      = 12.03.94
TT.MM.JJJJ    = 12.03.2094
JJJJ-MM-TT    = 2094-03-12
HH:MM:SS      = 10:56:27
HH:MM:SS,MS   = 10:56:27,98
Timestamp     = 12.03.2094 10:56:27,98
Datum/Zeit    = Freitag, 12.M„rz 2094, 10:56:27
absolute Zeit = 764.523 Tage == 6.605.482.658.798 HS
18.00.78 22:56:27,98
454:56:27,98
78 Jahre 00 Monate 18 Tage, 22:56:27,98
78,057 Jahre / 936,683 Monate / 4.072,565 Wochen / 28.507,956 Tage / 684.190,941 h / 41.051.456,466 min / 2.463.087.387,98 s
nachher:6.609.372.495.506
Wochentag     = Sonntag
TT.MM.JJ      = 05.06.95
TT.MM.JJJJ    = 05.06.2095
JJJJ-MM-TT    = 2095-06-05
HH:MM:SS      = 16:02:35
HH:MM:SS,MS   = 16:02:35,06
Timestamp     = 05.06.2095 16:02:35,06
Datum/Zeit    = Sonntag, 05.Juni 2095, 16:02:35
absolute Zeit = 764.973 Tage == 6.609.372.495.506 HS
14.03.79 04:02:35,06
340:02:35,06
79 Jahre 03 Monate 14 Tage, 04:02:35,06
79,290 Jahre / 951,476 Monate / 4.136,881 Wochen / 28.958,168 Tage / 694.996,043 h / 41.699.762,584 min / 2.501.985.755,06 s
i=35
vorher: 6.609.372.495.506
nachher:6.612.854.781.607
Wochentag     = Donnerstag
TT.MM.JJ      = 12.07.96
TT.MM.JJJJ    = 12.07.2096
JJJJ-MM-TT    = 2096-07-12
HH:MM:SS      = 17:03:36
HH:MM:SS,MS   = 17:03:36,07
Timestamp     = 12.07.2096 17:03:36,07
Datum/Zeit    = Donnerstag, 12.Juli 2096, 17:03:36
absolute Zeit = 765.376 Tage == 6.612.854.781.607 HS
20.04.80 05:03:36,07
485:03:36,07
80 Jahre 04 Monate 20 Tage, 05:03:36,07
80,393 Jahre / 964,719 Monate / 4.194,459 Wochen / 29.361,211 Tage / 704.669,060 h / 42.280.143,601 min / 2.536.808.616,07 s
nachher:6.616.744.618.315
Wochentag     = Sonnabend
TT.MM.JJ      = 05.10.97
TT.MM.JJJJ    = 05.10.2097
JJJJ-MM-TT    = 2097-10-05
HH:MM:SS      = 22:09:43
HH:MM:SS,MS   = 22:09:43,15
Timestamp     = 05.10.2097 22:09:43,15
Datum/Zeit    = Sonnabend, 05.Oktober 2097, 22:09:43
absolute Zeit = 765.826 Tage == 6.616.744.618.315 HS
13.07.81 10:09:43,15
322:09:43,15
81 Jahre 07 Monate 13 Tage, 10:09:43,15
81,626 Jahre / 979,511 Monate / 4.258,775 Wochen / 29.811,423 Tage / 715.474,162 h / 42.928.449,719 min / 2.575.706.983,15 s
i=36
vorher: 6.616.744.618.315
nachher:6.620.226.904.416
Wochentag     = Mittwoch
TT.MM.JJ      = 12.11.98
TT.MM.JJJJ    = 12.11.2098
JJJJ-MM-TT    = 2098-11-12
HH:MM:SS      = 23:10:44
HH:MM:SS,MS   = 23:10:44,16
Timestamp     = 12.11.2098 23:10:44,16
Datum/Zeit    = Mittwoch, 12.November 2098, 23:10:44
absolute Zeit = 766.229 Tage == 6.620.226.904.416 HS
21.08.82 11:10:44,16
515:10:44,16
82 Jahre 08 Monate 21 Tage, 11:10:44,16
82,729 Jahre / 992,754 Monate / 4.316,352 Wochen / 30.214,466 Tage / 725.147,179 h / 43.508.830,736 min / 2.610.529.844,16 s
nachher:6.624.116.741.124
Wochentag     = Sonnabend
TT.MM.JJ      = 06.02.00
TT.MM.JJJJ    = 06.02.2100
JJJJ-MM-TT    = 2100-02-06
HH:MM:SS      = 04:16:51
HH:MM:SS,MS   = 04:16:51,24
Timestamp     = 06.02.2100 04:16:51,24
Datum/Zeit    = Sonnabend, 06.Februar 2100, 04:16:51
absolute Zeit = 766.680 Tage == 6.624.116.741.124 HS
14.11.83 16:16:51,24
352:16:51,24
83 Jahre 11 Monate 14 Tage, 16:16:51,24
83,962 Jahre / 1.007,547 Monate / 4.380,668 Wochen / 30.664,678 Tage / 735.952,281 h / 44.157.136,854 min / 2.649.428.211,24 s
i=37
vorher: 6.624.116.741.124
nachher:6.627.599.027.225
Wochentag     = Mittwoch
TT.MM.JJ      = 16.03.01
TT.MM.JJJJ    = 16.03.2101
JJJJ-MM-TT    = 2101-03-16
HH:MM:SS      = 05:17:52
HH:MM:SS,MS   = 05:17:52,25
Timestamp     = 16.03.2101 05:17:52,25
Datum/Zeit    = Mittwoch, 16.M„rz 2101, 05:17:52
absolute Zeit = 767.083 Tage == 6.627.599.027.225 HS
22.00.85 17:17:52,25
545:17:52,25
85 Jahre 00 Monate 22 Tage, 17:17:52,25
85,066 Jahre / 1.020,789 Monate / 4.438,246 Wochen / 31.067,721 Tage / 745.625,298 h / 44.737.517,871 min / 2.684.251.072,25 s
nachher:6.631.488.863.933
Wochentag     = Freitag
TT.MM.JJ      = 09.06.02
TT.MM.JJJJ    = 09.06.2102
JJJJ-MM-TT    = 2102-06-09
HH:MM:SS      = 10:23:59
HH:MM:SS,MS   = 10:23:59,33
Timestamp     = 09.06.2102 10:23:59,33
Datum/Zeit    = Freitag, 09.Juni 2102, 10:23:59
absolute Zeit = 767.533 Tage == 6.631.488.863.933 HS
17.03.86 22:23:59,33
430:23:59,33
86 Jahre 03 Monate 17 Tage, 22:23:59,33
86,298 Jahre / 1.035,582 Monate / 4.502,562 Wochen / 31.517,933 Tage / 756.430,400 h / 45.385.823,989 min / 2.723.149.439,33 s
i=38
vorher: 6.631.488.863.933
nachher:6.634.971.150.034
Wochentag     = Dienstag
TT.MM.JJ      = 17.07.03
TT.MM.JJJJ    = 17.07.2103
JJJJ-MM-TT    = 2103-07-17
HH:MM:SS      = 11:25:00
HH:MM:SS,MS   = 11:25:00,34
Timestamp     = 17.07.2103 11:25:00,34
Datum/Zeit    = Dienstag, 17.Juli 2103, 11:25:00
absolute Zeit = 767.936 Tage == 6.634.971.150.034 HS
24.04.87 23:25:00,34
599:25:00,34
87 Jahre 04 Monate 24 Tage, 23:25:00,34
87,402 Jahre / 1.048,825 Monate / 4.560,139 Wochen / 31.920,976 Tage / 766.103,417 h / 45.966.205,006 min / 2.757.972.300,34 s
nachher:6.638.860.986.742
Wochentag     = Donnerstag
TT.MM.JJ      = 09.10.04
TT.MM.JJJJ    = 09.10.2104
JJJJ-MM-TT    = 2104-10-09
HH:MM:SS      = 16:31:07
HH:MM:SS,MS   = 16:31:07,42
Timestamp     = 09.10.2104 16:31:07,42
Datum/Zeit    = Donnerstag, 09.Oktober 2104, 16:31:07
absolute Zeit = 768.386 Tage == 6.638.860.986.742 HS
17.07.88 04:31:07,42
412:31:07,42
88 Jahre 07 Monate 17 Tage, 04:31:07,42
88,635 Jahre / 1.063,617 Monate / 4.624,455 Wochen / 32.371,188 Tage / 776.908,519 h / 46.614.511,124 min / 2.796.870.667,42 s
i=39
vorher: 6.638.860.986.742
nachher:6.642.343.272.843
Wochentag     = Montag
TT.MM.JJ      = 16.11.05
TT.MM.JJJJ    = 16.11.2105
JJJJ-MM-TT    = 2105-11-16
HH:MM:SS      = 17:32:08
HH:MM:SS,MS   = 17:32:08,43
Timestamp     = 16.11.2105 17:32:08,43
Datum/Zeit    = Montag, 16.November 2105, 17:32:08
absolute Zeit = 768.789 Tage == 6.642.343.272.843 HS
25.08.89 05:32:08,43
605:32:08,43
89 Jahre 08 Monate 25 Tage, 05:32:08,43
89,738 Jahre / 1.076,860 Monate / 4.682,033 Wochen / 32.774,231 Tage / 786.581,536 h / 47.194.892,140 min / 2.831.693.528,43 s
nachher:6.646.233.109.551
Wochentag     = Mittwoch
TT.MM.JJ      = 09.02.07
TT.MM.JJJJ    = 09.02.2107
JJJJ-MM-TT    = 2107-02-09
HH:MM:SS      = 22:38:15
HH:MM:SS,MS   = 22:38:15,51
Timestamp     = 09.02.2107 22:38:15,51
Datum/Zeit    = Mittwoch, 09.Februar 2107, 22:38:15
absolute Zeit = 769.239 Tage == 6.646.233.109.551 HS
18.11.90 10:38:15,51
442:38:15,51
90 Jahre 11 Monate 18 Tage, 10:38:15,51
90,971 Jahre / 1.091,652 Monate / 4.746,349 Wochen / 33.224,443 Tage / 797.386,638 h / 47.843.198,259 min / 2.870.591.895,51 s
i=40
vorher: 6.646.233.109.551
nachher:6.649.715.395.652
Wochentag     = Sonntag
TT.MM.JJ      = 18.03.08
TT.MM.JJJJ    = 18.03.2108
JJJJ-MM-TT    = 2108-03-18
HH:MM:SS      = 23:39:16
HH:MM:SS,MS   = 23:39:16,52
Timestamp     = 18.03.2108 23:39:16,52
Datum/Zeit    = Sonntag, 18.M„rz 2108, 23:39:16
absolute Zeit = 769.642 Tage == 6.649.715.395.652 HS
25.00.92 11:39:16,52
611:39:16,52
92 Jahre 00 Monate 25 Tage, 11:39:16,52
92,075 Jahre / 1.104,895 Monate / 4.803,927 Wochen / 33.627,486 Tage / 807.059,655 h / 48.423.579,275 min / 2.905.414.756,52 s
nachher:6.653.605.232.360
Wochentag     = Mittwoch
TT.MM.JJ      = 12.06.09
TT.MM.JJJJ    = 12.06.2109
JJJJ-MM-TT    = 2109-06-12
HH:MM:SS      = 04:45:23
HH:MM:SS,MS   = 04:45:23,60
Timestamp     = 12.06.2109 04:45:23,60
Datum/Zeit    = Mittwoch, 12.Juni 2109, 04:45:23
absolute Zeit = 770.093 Tage == 6.653.605.232.360 HS
20.03.93 16:45:23,60
496:45:23,60
93 Jahre 03 Monate 20 Tage, 16:45:23,60
93,307 Jahre / 1.119,688 Monate / 4.868,243 Wochen / 34.077,698 Tage / 817.864,757 h / 49.071.885,393 min / 2.944.313.123,60 s
i=41
vorher: 6.653.605.232.360
nachher:6.657.087.518.461
Wochentag     = Sonntag
TT.MM.JJ      = 20.07.10
TT.MM.JJJJ    = 20.07.2110
JJJJ-MM-TT    = 2110-07-20
HH:MM:SS      = 05:46:24
HH:MM:SS,MS   = 05:46:24,61
Timestamp     = 20.07.2110 05:46:24,61
Datum/Zeit    = Sonntag, 20.Juli 2110, 05:46:24
absolute Zeit = 770.496 Tage == 6.657.087.518.461 HS
27.04.94 17:46:24,61
665:46:24,61
94 Jahre 04 Monate 27 Tage, 17:46:24,61
94,411 Jahre / 1.132,931 Monate / 4.925,820 Wochen / 34.480,741 Tage / 827.537,774 h / 49.652.266,410 min / 2.979.135.984,61 s
nachher:6.660.977.355.169
Wochentag     = Dienstag
TT.MM.JJ      = 13.10.11
TT.MM.JJJJ    = 13.10.2111
JJJJ-MM-TT    = 2111-10-13
HH:MM:SS      = 10:52:31
HH:MM:SS,MS   = 10:52:31,69
Timestamp     = 13.10.2111 10:52:31,69
Datum/Zeit    = Dienstag, 13.Oktober 2111, 10:52:31
absolute Zeit = 770.946 Tage == 6.660.977.355.169 HS
20.07.95 22:52:31,69
502:52:31,69
95 Jahre 07 Monate 20 Tage, 22:52:31,69
95,644 Jahre / 1.147,723 Monate / 4.990,136 Wochen / 34.930,953 Tage / 838.342,875 h / 50.300.572,528 min / 3.018.034.351,69 s
i=42
vorher: 6.660.977.355.169
nachher:6.664.459.641.270
Wochentag     = Sonnabend
TT.MM.JJ      = 19.11.12
TT.MM.JJJJ    = 19.11.2112
JJJJ-MM-TT    = 2112-11-19
HH:MM:SS      = 11:53:32
HH:MM:SS,MS   = 11:53:32,70
Timestamp     = 19.11.2112 11:53:32,70
Datum/Zeit    = Sonnabend, 19.November 2112, 11:53:32
absolute Zeit = 771.349 Tage == 6.664.459.641.270 HS
27.08.96 23:53:32,70
671:53:32,70
96 Jahre 08 Monate 27 Tage, 23:53:32,70
96,747 Jahre / 1.160,966 Monate / 5.047,714 Wochen / 35.333,996 Tage / 848.015,892 h / 50.880.953,545 min / 3.052.857.212,70 s
nachher:6.668.349.477.978
Wochentag     = Montag
TT.MM.JJ      = 12.02.14
TT.MM.JJJJ    = 12.02.2114
JJJJ-MM-TT    = 2114-02-12
HH:MM:SS      = 16:59:39
HH:MM:SS,MS   = 16:59:39,78
Timestamp     = 12.02.2114 16:59:39,78
Datum/Zeit    = Montag, 12.Februar 2114, 16:59:39
absolute Zeit = 771.799 Tage == 6.668.349.477.978 HS
21.11.97 04:59:39,78
508:59:39,78
97 Jahre 11 Monate 21 Tage, 04:59:39,78
97,980 Jahre / 1.175,758 Monate / 5.112,030 Wochen / 35.784,208 Tage / 858.820,994 h / 51.529.259,663 min / 3.091.755.579,78 s
i=43
vorher: 6.668.349.477.978
nachher:6.671.831.764.079
Wochentag     = Freitag
TT.MM.JJ      = 22.03.15
TT.MM.JJJJ    = 22.03.2115
JJJJ-MM-TT    = 2115-03-22
HH:MM:SS      = 18:00:40
HH:MM:SS,MS   = 18:00:40,79
Timestamp     = 22.03.2115 18:00:40,79
Datum/Zeit    = Freitag, 22.M„rz 2115, 18:00:40
absolute Zeit = 772.202 Tage == 6.671.831.764.079 HS
00.01.99 06:00:40,79
06:00:40,79
99 Jahre 01 Monate 00 Tage, 06:00:40,79
99,083 Jahre / 1.189,001 Monate / 5.169,607 Wochen / 36.187,250 Tage / 868.494,011 h / 52.109.640,680 min / 3.126.578.440,79 s
nachher:6.675.721.600.787
Wochentag     = Sonntag
TT.MM.JJ      = 14.06.16
TT.MM.JJJJ    = 14.06.2116
JJJJ-MM-TT    = 2116-06-14
HH:MM:SS      = 23:06:47
HH:MM:SS,MS   = 23:06:47,87
Timestamp     = 14.06.2116 23:06:47,87
Datum/Zeit    = Sonntag, 14.Juni 2116, 23:06:47
absolute Zeit = 772.652 Tage == 6.675.721.600.787 HS
23.03.100 11:06:47,87
563:06:47,87
100 Jahre 03 Monate 23 Tage, 11:06:47,87
100,316 Jahre / 1.203,794 Monate / 5.233,923 Wochen / 36.637,463 Tage / 879.299,113 h / 52.757.946,798 min / 3.165.476.807,87 s
i=44
vorher: 6.675.721.600.787
nachher:6.679.203.886.888
Wochentag     = Freitag
TT.MM.JJ      = 23.07.17
TT.MM.JJJJ    = 23.07.2117
JJJJ-MM-TT    = 2117-07-23
HH:MM:SS      = 00:07:48
HH:MM:SS,MS   = 00:07:48,88
Timestamp     = 23.07.2117 00:07:48,88
Datum/Zeit    = Freitag, 23.Juli 2117, 00:07:48
absolute Zeit = 773.056 Tage == 6.679.203.886.888 HS
00.05.101 12:07:48,88
12:07:48,88
101 Jahre 05 Monate 00 Tage, 12:07:48,88
101,420 Jahre / 1.217,036 Monate / 5.291,501 Wochen / 37.040,505 Tage / 888.972,130 h / 53.338.327,815 min / 3.200.299.668,88 s
nachher:6.683.093.723.596
Wochentag     = Sonntag
TT.MM.JJ      = 16.10.18
TT.MM.JJJJ    = 16.10.2118
JJJJ-MM-TT    = 2118-10-16
HH:MM:SS      = 05:13:55
HH:MM:SS,MS   = 05:13:55,96
Timestamp     = 16.10.2118 05:13:55,96
Datum/Zeit    = Sonntag, 16.Oktober 2118, 05:13:55
absolute Zeit = 773.506 Tage == 6.683.093.723.596 HS
23.07.102 17:13:55,96
569:13:55,96
102 Jahre 07 Monate 23 Tage, 17:13:55,96
102,652 Jahre / 1.231,829 Monate / 5.355,817 Wochen / 37.490,718 Tage / 899.777,232 h / 53.986.633,933 min / 3.239.198.035,96 s
i=45
vorher: 6.683.093.723.596
nachher:6.686.576.009.697
Wochentag     = Donnerstag
TT.MM.JJ      = 23.11.19
TT.MM.JJJJ    = 23.11.2119
JJJJ-MM-TT    = 2119-11-23
HH:MM:SS      = 06:14:56
HH:MM:SS,MS   = 06:14:56,97
Timestamp     = 23.11.2119 06:14:56,97
Datum/Zeit    = Donnerstag, 23.November 2119, 06:14:56
absolute Zeit = 773.909 Tage == 6.686.576.009.697 HS
00.09.103 18:14:56,97
18:14:56,97
103 Jahre 09 Monate 00 Tage, 18:14:56,97
103,756 Jahre / 1.245,072 Monate / 5.413,394 Wochen / 37.893,760 Tage / 909.450,249 h / 54.567.014,949 min / 3.274.020.896,97 s
nachher:6.690.465.846.405
Wochentag     = Sonnabend
TT.MM.JJ      = 15.02.21
TT.MM.JJJJ    = 15.02.2121
JJJJ-MM-TT    = 2121-02-15
HH:MM:SS      = 11:21:04
HH:MM:SS,MS   = 11:21:04,05
Timestamp     = 15.02.2121 11:21:04,05
Datum/Zeit    = Sonnabend, 15.Februar 2121, 11:21:04
absolute Zeit = 774.359 Tage == 6.690.465.846.405 HS
23.11.104 23:21:04,05
575:21:04,05
104 Jahre 11 Monate 23 Tage, 23:21:04,05
104,989 Jahre / 1.259,864 Monate / 5.477,710 Wochen / 38.343,973 Tage / 920.255,351 h / 55.215.321,068 min / 3.312.919.264,05 s
i=46
vorher: 6.690.465.846.405
nachher:6.693.948.132.506
Wochentag     = Mittwoch
TT.MM.JJ      = 25.03.22
TT.MM.JJJJ    = 25.03.2122
JJJJ-MM-TT    = 2122-03-25
HH:MM:SS      = 12:22:05
HH:MM:SS,MS   = 12:22:05,06
Timestamp     = 25.03.2122 12:22:05,06
Datum/Zeit    = Mittwoch, 25.M„rz 2122, 12:22:05
absolute Zeit = 774.762 Tage == 6.693.948.132.506 HS
03.01.106 00:22:05,06
72:22:05,06
106 Jahre 01 Monate 03 Tage, 00:22:05,06
106,092 Jahre / 1.273,107 Monate / 5.535,288 Wochen / 38.747,015 Tage / 929.928,368 h / 55.795.702,084 min / 3.347.742.125,06 s
nachher:6.697.837.969.214
Wochentag     = Freitag
TT.MM.JJ      = 18.06.23
TT.MM.JJJJ    = 18.06.2123
JJJJ-MM-TT    = 2123-06-18
HH:MM:SS      = 17:28:12
HH:MM:SS,MS   = 17:28:12,14
Timestamp     = 18.06.2123 17:28:12,14
Datum/Zeit    = Freitag, 18.Juni 2123, 17:28:12
absolute Zeit = 775.212 Tage == 6.697.837.969.214 HS
27.03.107 05:28:12,14
653:28:12,14
107 Jahre 03 Monate 27 Tage, 05:28:12,14
107,325 Jahre / 1.287,900 Monate / 5.599,604 Wochen / 39.197,228 Tage / 940.733,470 h / 56.444.008,202 min / 3.386.640.492,14 s
i=47
vorher: 6.697.837.969.214
nachher:6.701.320.255.315
Wochentag     = Dienstag
TT.MM.JJ      = 25.07.24
TT.MM.JJJJ    = 25.07.2124
JJJJ-MM-TT    = 2124-07-25
HH:MM:SS      = 18:29:13
HH:MM:SS,MS   = 18:29:13,15
Timestamp     = 25.07.2124 18:29:13,15
Datum/Zeit    = Dienstag, 25.Juli 2124, 18:29:13
absolute Zeit = 775.615 Tage == 6.701.320.255.315 HS
03.05.108 06:29:13,15
78:29:13,15
108 Jahre 05 Monate 03 Tage, 06:29:13,15
108,429 Jahre / 1.301,142 Monate / 5.657,181 Wochen / 39.600,270 Tage / 950.406,487 h / 57.024.389,219 min / 3.421.463.353,15 s
nachher:6.705.210.092.023
Wochentag     = Donnerstag
TT.MM.JJ      = 18.10.25
TT.MM.JJJJ    = 18.10.2125
JJJJ-MM-TT    = 2125-10-18
HH:MM:SS      = 23:35:20
HH:MM:SS,MS   = 23:35:20,23
Timestamp     = 18.10.2125 23:35:20,23
Datum/Zeit    = Donnerstag, 18.Oktober 2125, 23:35:20
absolute Zeit = 776.065 Tage == 6.705.210.092.023 HS
26.07.109 11:35:20,23
635:35:20,23
109 Jahre 07 Monate 26 Tage, 11:35:20,23
109,661 Jahre / 1.315,935 Monate / 5.721,498 Wochen / 40.050,483 Tage / 961.211,589 h / 57.672.695,337 min / 3.460.361.720,23 s
i=48
vorher: 6.705.210.092.023
nachher:6.708.692.378.124
Wochentag     = Dienstag
TT.MM.JJ      = 26.11.26
TT.MM.JJJJ    = 26.11.2126
JJJJ-MM-TT    = 2126-11-26
HH:MM:SS      = 00:36:21
HH:MM:SS,MS   = 00:36:21,24
Timestamp     = 26.11.2126 00:36:21,24
Datum/Zeit    = Dienstag, 26.November 2126, 00:36:21
absolute Zeit = 776.469 Tage == 6.708.692.378.124 HS
03.09.110 12:36:21,24
84:36:21,24
110 Jahre 09 Monate 03 Tage, 12:36:21,24
110,765 Jahre / 1.329,178 Monate / 5.779,075 Wochen / 40.453,525 Tage / 970.884,606 h / 58.253.076,354 min / 3.495.184.581,24 s
nachher:6.712.582.214.832
Wochentag     = Donnerstag
TT.MM.JJ      = 19.02.28
TT.MM.JJJJ    = 19.02.2128
JJJJ-MM-TT    = 2128-02-19
HH:MM:SS      = 05:42:28
HH:MM:SS,MS   = 05:42:28,32
Timestamp     = 19.02.2128 05:42:28,32
Datum/Zeit    = Donnerstag, 19.Februar 2128, 05:42:28
absolute Zeit = 776.919 Tage == 6.712.582.214.832 HS
27.11.111 17:42:28,32
665:42:28,32
111 Jahre 11 Monate 27 Tage, 17:42:28,32
111,998 Jahre / 1.343,970 Monate / 5.843,391 Wochen / 40.903,738 Tage / 981.689,708 h / 58.901.382,472 min / 3.534.082.948,32 s
i=49
vorher: 6.712.582.214.832
nachher:6.716.064.500.933
Wochentag     = Montag
TT.MM.JJ      = 28.03.29
TT.MM.JJJJ    = 28.03.2129
JJJJ-MM-TT    = 2129-03-28
HH:MM:SS      = 06:43:29
HH:MM:SS,MS   = 06:43:29,33
Timestamp     = 28.03.2129 06:43:29,33
Datum/Zeit    = Montag, 28.M„rz 2129, 06:43:29
absolute Zeit = 777.322 Tage == 6.716.064.500.933 HS
05.01.113 18:43:29,33
138:43:29,33
113 Jahre 01 Monate 05 Tage, 18:43:29,33
113,101 Jahre / 1.357,213 Monate / 5.900,969 Wochen / 41.306,780 Tage / 991.362,725 h / 59.481.763,489 min / 3.568.905.809,33 s
nachher:6.719.954.337.641
Wochentag     = Mittwoch
TT.MM.JJ      = 21.06.30
TT.MM.JJJJ    = 21.06.2130
JJJJ-MM-TT    = 2130-06-21
HH:MM:SS      = 11:49:36
HH:MM:SS,MS   = 11:49:36,41
Timestamp     = 21.06.2130 11:49:36,41
Datum/Zeit    = Mittwoch, 21.Juni 2130, 11:49:36
absolute Zeit = 777.772 Tage == 6.719.954.337.641 HS
29.03.114 23:49:36,41
719:49:36,41
114 Jahre 03 Monate 29 Tage, 23:49:36,41
114,334 Jahre / 1.372,006 Monate / 5.965,285 Wochen / 41.756,993 Tage / 1.002.167,827 h / 60.130.069,607 min / 3.607.804.176,41 s
i=50
vorher: 6.719.954.337.641
nachher:6.723.436.623.742
Wochentag     = Sonntag
TT.MM.JJ      = 29.07.31
TT.MM.JJJJ    = 29.07.2131
JJJJ-MM-TT    = 2131-07-29
HH:MM:SS      = 12:50:37
HH:MM:SS,MS   = 12:50:37,42
Timestamp     = 29.07.2131 12:50:37,42
Datum/Zeit    = Sonntag, 29.Juli 2131, 12:50:37
absolute Zeit = 778.175 Tage == 6.723.436.623.742 HS
07.05.115 00:50:37,42
168:50:37,42
115 Jahre 05 Monate 07 Tage, 00:50:37,42
115,437 Jahre / 1.385,248 Monate / 6.022,862 Wochen / 42.160,035 Tage / 1.011.840,844 h / 60.710.450,624 min / 3.642.627.037,42 s
nachher:6.727.326.460.450
Wochentag     = Dienstag
TT.MM.JJ      = 21.10.32
TT.MM.JJJJ    = 21.10.2132
JJJJ-MM-TT    = 2132-10-21
HH:MM:SS      = 17:56:44
HH:MM:SS,MS   = 17:56:44,50
Timestamp     = 21.10.2132 17:56:44,50
Datum/Zeit    = Dienstag, 21.Oktober 2132, 17:56:44
absolute Zeit = 778.625 Tage == 6.727.326.460.450 HS
29.07.116 05:56:44,50
701:56:44,50
116 Jahre 07 Monate 29 Tage, 05:56:44,50
116,670 Jahre / 1.400,041 Monate / 6.087,178 Wochen / 42.610,248 Tage / 1.022.645,946 h / 61.358.756,742 min / 3.681.525.404,50 s
i=51
vorher: 6.727.326.460.450
nachher:6.730.808.746.551
Wochentag     = Sonnabend
TT.MM.JJ      = 28.11.33
TT.MM.JJJJ    = 28.11.2133
JJJJ-MM-TT    = 2133-11-28
HH:MM:SS      = 18:57:45
HH:MM:SS,MS   = 18:57:45,51
Timestamp     = 28.11.2133 18:57:45,51
Datum/Zeit    = Sonnabend, 28.November 2133, 18:57:45
absolute Zeit = 779.028 Tage == 6.730.808.746.551 HS
06.09.117 06:57:45,51
150:57:45,51
117 Jahre 09 Monate 06 Tage, 06:57:45,51
117,774 Jahre / 1.413,284 Monate / 6.144,756 Wochen / 43.013,290 Tage / 1.032.318,963 h / 61.939.137,759 min / 3.716.348.265,51 s
nachher:6.734.698.583.259
Wochentag     = Dienstag
TT.MM.JJ      = 22.02.35
TT.MM.JJJJ    = 22.02.2135
JJJJ-MM-TT    = 2135-02-22
HH:MM:SS      = 00:03:52
HH:MM:SS,MS   = 00:03:52,59
Timestamp     = 22.02.2135 00:03:52,59
Datum/Zeit    = Dienstag, 22.Februar 2135, 00:03:52
absolute Zeit = 779.479 Tage == 6.734.698.583.259 HS
30.11.118 12:03:52,59
732:03:52,59
118 Jahre 11 Monate 30 Tage, 12:03:52,59
119,006 Jahre / 1.428,076 Monate / 6.209,072 Wochen / 43.463,503 Tage / 1.043.124,065 h / 62.587.443,877 min / 3.755.246.632,59 s
i=52
vorher: 6.734.698.583.259
nachher:6.738.180.869.360
Wochentag     = Sonnabend
TT.MM.JJ      = 31.03.36
TT.MM.JJJJ    = 31.03.2136
JJJJ-MM-TT    = 2136-03-31
HH:MM:SS      = 01:04:53
HH:MM:SS,MS   = 01:04:53,60
Timestamp     = 31.03.2136 01:04:53,60
Datum/Zeit    = Sonnabend, 31.M„rz 2136, 01:04:53
absolute Zeit = 779.882 Tage == 6.738.180.869.360 HS
08.01.120 13:04:53,60
205:04:53,60
120 Jahre 01 Monate 08 Tage, 13:04:53,60
120,110 Jahre / 1.441,319 Monate / 6.266,649 Wochen / 43.866,545 Tage / 1.052.797,082 h / 63.167.824,893 min / 3.790.069.493,60 s
nachher:6.742.070.706.068
Wochentag     = Montag
TT.MM.JJ      = 24.06.37
TT.MM.JJJJ    = 24.06.2137
JJJJ-MM-TT    = 2137-06-24
HH:MM:SS      = 06:11:00
HH:MM:SS,MS   = 06:11:00,68
Timestamp     = 24.06.2137 06:11:00,68
Datum/Zeit    = Montag, 24.Juni 2137, 06:11:00
absolute Zeit = 780.332 Tage == 6.742.070.706.068 HS
01.04.121 18:11:00,68
42:11:00,68
121 Jahre 04 Monate 01 Tage, 18:11:00,68
121,343 Jahre / 1.456,112 Monate / 6.330,965 Wochen / 44.316,758 Tage / 1.063.602,184 h / 63.816.131,011 min / 3.828.967.860,68 s
i=53
vorher: 6.742.070.706.068
nachher:6.745.552.992.169
Wochentag     = Freitag
TT.MM.JJ      = 01.08.38
TT.MM.JJJJ    = 01.08.2138
JJJJ-MM-TT    = 2138-08-01
HH:MM:SS      = 07:12:01
HH:MM:SS,MS   = 07:12:01,69
Timestamp     = 01.08.2138 07:12:01,69
Datum/Zeit    = Freitag, 01.August 2138, 07:12:01
absolute Zeit = 780.735 Tage == 6.745.552.992.169 HS
09.05.122 19:12:01,69
235:12:01,69
122 Jahre 05 Monate 09 Tage, 19:12:01,69
122,446 Jahre / 1.469,354 Monate / 6.388,543 Wochen / 44.719,800 Tage / 1.073.275,200 h / 64.396.512,028 min / 3.863.790.721,69 s
nachher:6.749.442.828.877
Wochentag     = Sonntag
TT.MM.JJ      = 25.10.39
TT.MM.JJJJ    = 25.10.2139
JJJJ-MM-TT    = 2139-10-25
HH:MM:SS      = 12:18:08
HH:MM:SS,MS   = 12:18:08,77
Timestamp     = 25.10.2139 12:18:08,77
Datum/Zeit    = Sonntag, 25.Oktober 2139, 12:18:08
absolute Zeit = 781.185 Tage == 6.749.442.828.877 HS
03.08.123 00:18:08,77
72:18:08,77
123 Jahre 08 Monate 03 Tage, 00:18:08,77
123,679 Jahre / 1.484,147 Monate / 6.452,859 Wochen / 45.170,013 Tage / 1.084.080,302 h / 65.044.818,146 min / 3.902.689.088,77 s
i=54
vorher: 6.749.442.828.877
nachher:6.752.925.114.978
Wochentag     = Donnerstag
TT.MM.JJ      = 01.12.40
TT.MM.JJJJ    = 01.12.2140
JJJJ-MM-TT    = 2140-12-01
HH:MM:SS      = 13:19:09
HH:MM:SS,MS   = 13:19:09,78
Timestamp     = 01.12.2140 13:19:09,78
Datum/Zeit    = Donnerstag, 01.Dezember 2140, 13:19:09
absolute Zeit = 781.588 Tage == 6.752.925.114.978 HS
09.09.124 01:19:09,78
217:19:09,78
124 Jahre 09 Monate 09 Tage, 01:19:09,78
124,782 Jahre / 1.497,390 Monate / 6.510,436 Wochen / 45.573,055 Tage / 1.093.753,319 h / 65.625.199,163 min / 3.937.511.949,78 s
nachher:6.756.814.951.686
Wochentag     = Sonnabend
TT.MM.JJ      = 24.02.42
TT.MM.JJJJ    = 24.02.2142
JJJJ-MM-TT    = 2142-02-24
HH:MM:SS      = 18:25:16
HH:MM:SS,MS   = 18:25:16,86
Timestamp     = 24.02.2142 18:25:16,86
Datum/Zeit    = Sonnabend, 24.Februar 2142, 18:25:16
absolute Zeit = 782.038 Tage == 6.756.814.951.686 HS
02.00.126 06:25:16,86
54:25:16,86
126 Jahre 00 Monate 02 Tage, 06:25:16,86
126,015 Jahre / 1.512,182 Monate / 6.574,753 Wochen / 46.023,268 Tage / 1.104.558,421 h / 66.273.505,281 min / 3.976.410.316,86 s
i=55
vorher: 6.756.814.951.686
nachher:6.760.297.237.787
Wochentag     = Mittwoch
TT.MM.JJ      = 03.04.43
TT.MM.JJJJ    = 03.04.2143
JJJJ-MM-TT    = 2143-04-03
HH:MM:SS      = 19:26:17
HH:MM:SS,MS   = 19:26:17,87
Timestamp     = 03.04.2143 19:26:17,87
Datum/Zeit    = Mittwoch, 03.April 2143, 19:26:17
absolute Zeit = 782.441 Tage == 6.760.297.237.787 HS
12.01.127 07:26:17,87
295:26:17,87
127 Jahre 01 Monate 12 Tage, 07:26:17,87
127,119 Jahre / 1.525,425 Monate / 6.632,330 Wochen / 46.426,310 Tage / 1.114.231,438 h / 66.853.886,298 min / 4.011.233.177,87 s
nachher:6.764.187.074.495
Wochentag     = Sonnabend
TT.MM.JJ      = 27.06.44
TT.MM.JJJJ    = 27.06.2144
JJJJ-MM-TT    = 2144-06-27
HH:MM:SS      = 00:32:24
HH:MM:SS,MS   = 00:32:24,95
Timestamp     = 27.06.2144 00:32:24,95
Datum/Zeit    = Sonnabend, 27.Juni 2144, 00:32:24
absolute Zeit = 782.892 Tage == 6.764.187.074.495 HS
04.04.128 12:32:24,95
108:32:24,95
128 Jahre 04 Monate 04 Tage, 12:32:24,95
128,351 Jahre / 1.540,218 Monate / 6.696,646 Wochen / 46.876,523 Tage / 1.125.036,540 h / 67.502.192,416 min / 4.050.131.544,95 s
i=56
vorher: 6.764.187.074.495
nachher:6.767.669.360.596
Wochentag     = Mittwoch
TT.MM.JJ      = 04.08.45
TT.MM.JJJJ    = 04.08.2145
JJJJ-MM-TT    = 2145-08-04
HH:MM:SS      = 01:33:25
HH:MM:SS,MS   = 01:33:25,96
Timestamp     = 04.08.2145 01:33:25,96
Datum/Zeit    = Mittwoch, 04.August 2145, 01:33:25
absolute Zeit = 783.295 Tage == 6.767.669.360.596 HS
12.05.129 13:33:25,96
301:33:25,96
129 Jahre 05 Monate 12 Tage, 13:33:25,96
129,455 Jahre / 1.553,460 Monate / 6.754,224 Wochen / 47.279,565 Tage / 1.134.709,557 h / 68.082.573,433 min / 4.084.954.405,96 s
nachher:6.771.559.197.304
Wochentag     = Freitag
TT.MM.JJ      = 28.10.46
TT.MM.JJJJ    = 28.10.2146
JJJJ-MM-TT    = 2146-10-28
HH:MM:SS      = 06:39:33
HH:MM:SS,MS   = 06:39:33,04
Timestamp     = 28.10.2146 06:39:33,04
Datum/Zeit    = Freitag, 28.Oktober 2146, 06:39:33
absolute Zeit = 783.745 Tage == 6.771.559.197.304 HS
05.08.130 18:39:33,04
138:39:33,04
130 Jahre 08 Monate 05 Tage, 18:39:33,04
130,688 Jahre / 1.568,253 Monate / 6.818,540 Wochen / 47.729,777 Tage / 1.145.514,659 h / 68.730.879,551 min / 4.123.852.773,04 s
i=57
vorher: 6.771.559.197.304
nachher:6.775.041.483.405
Wochentag     = Dienstag
TT.MM.JJ      = 05.12.47
TT.MM.JJJJ    = 05.12.2147
JJJJ-MM-TT    = 2147-12-05
HH:MM:SS      = 07:40:34
HH:MM:SS,MS   = 07:40:34,05
Timestamp     = 05.12.2147 07:40:34,05
Datum/Zeit    = Dienstag, 05.Dezember 2147, 07:40:34
absolute Zeit = 784.148 Tage == 6.775.041.483.405 HS
12.09.131 19:40:34,05
307:40:34,05
131 Jahre 09 Monate 12 Tage, 19:40:34,05
131,791 Jahre / 1.581,496 Monate / 6.876,117 Wochen / 48.132,820 Tage / 1.155.187,676 h / 69.311.260,568 min / 4.158.675.634,05 s
nachher:6.778.931.320.113
Wochentag     = Donnerstag
TT.MM.JJ      = 27.02.49
TT.MM.JJJJ    = 27.02.2149
JJJJ-MM-TT    = 2149-02-27
HH:MM:SS      = 12:46:41
HH:MM:SS,MS   = 12:46:41,13
Timestamp     = 27.02.2149 12:46:41,13
Datum/Zeit    = Donnerstag, 27.Februar 2149, 12:46:41
absolute Zeit = 784.598 Tage == 6.778.931.320.113 HS
05.00.133 00:46:41,13
120:46:41,13
133 Jahre 00 Monate 05 Tage, 00:46:41,13
133,024 Jahre / 1.596,288 Monate / 6.940,433 Wochen / 48.583,032 Tage / 1.165.992,778 h / 69.959.566,685 min / 4.197.574.001,13 s
i=58
vorher: 6.778.931.320.113
nachher:6.782.413.606.214
Wochentag     = Montag
TT.MM.JJ      = 06.04.50
TT.MM.JJJJ    = 06.04.2150
JJJJ-MM-TT    = 2150-04-06
HH:MM:SS      = 13:47:42
HH:MM:SS,MS   = 13:47:42,14
Timestamp     = 06.04.2150 13:47:42,14
Datum/Zeit    = Montag, 06.April 2150, 13:47:42
absolute Zeit = 785.001 Tage == 6.782.413.606.214 HS
15.01.134 01:47:42,14
361:47:42,14
134 Jahre 01 Monate 15 Tage, 01:47:42,14
134,128 Jahre / 1.609,531 Monate / 6.998,011 Wochen / 48.986,075 Tage / 1.175.665,795 h / 70.539.947,702 min / 4.232.396.862,14 s
nachher:6.786.303.442.922
Wochentag     = Mittwoch
TT.MM.JJ      = 30.06.51
TT.MM.JJJJ    = 30.06.2151
JJJJ-MM-TT    = 2151-06-30
HH:MM:SS      = 18:53:49
HH:MM:SS,MS   = 18:53:49,22
Timestamp     = 30.06.2151 18:53:49,22
Datum/Zeit    = Mittwoch, 30.Juni 2151, 18:53:49
absolute Zeit = 785.451 Tage == 6.786.303.442.922 HS
08.04.135 06:53:49,22
198:53:49,22
135 Jahre 04 Monate 08 Tage, 06:53:49,22
135,360 Jahre / 1.624,324 Monate / 7.062,327 Wochen / 49.436,287 Tage / 1.186.470,897 h / 71.188.253,820 min / 4.271.295.229,22 s
i=59
vorher: 6.786.303.442.922
nachher:6.789.785.729.023
Wochentag     = Sonntag
TT.MM.JJ      = 06.08.52
TT.MM.JJJJ    = 06.08.2152
JJJJ-MM-TT    = 2152-08-06
HH:MM:SS      = 19:54:50
HH:MM:SS,MS   = 19:54:50,23
Timestamp     = 06.08.2152 19:54:50,23
Datum/Zeit    = Sonntag, 06.August 2152, 19:54:50
absolute Zeit = 785.854 Tage == 6.789.785.729.023 HS
15.05.136 07:54:50,23
367:54:50,23
136 Jahre 05 Monate 15 Tage, 07:54:50,23
136,464 Jahre / 1.637,566 Monate / 7.119,904 Wochen / 49.839,330 Tage / 1.196.143,914 h / 71.768.634,837 min / 4.306.118.090,23 s
nachher:6.793.675.565.731
Wochentag     = Mittwoch
TT.MM.JJ      = 31.10.53
TT.MM.JJJJ    = 31.10.2153
JJJJ-MM-TT    = 2153-10-31
HH:MM:SS      = 01:00:57
HH:MM:SS,MS   = 01:00:57,31
Timestamp     = 31.10.2153 01:00:57,31
Datum/Zeit    = Mittwoch, 31.Oktober 2153, 01:00:57
absolute Zeit = 786.305 Tage == 6.793.675.565.731 HS
08.08.137 13:00:57,31
205:00:57,31
137 Jahre 08 Monate 08 Tage, 13:00:57,31
137,697 Jahre / 1.652,359 Monate / 7.184,220 Wochen / 50.289,542 Tage / 1.206.949,016 h / 72.416.940,955 min / 4.345.016.457,31 s
i=60
vorher: 6.793.675.565.731
nachher:6.797.157.851.832
Wochentag     = Sonntag
TT.MM.JJ      = 08.12.54
TT.MM.JJJJ    = 08.12.2154
JJJJ-MM-TT    = 2154-12-08
HH:MM:SS      = 02:01:58
HH:MM:SS,MS   = 02:01:58,32
Timestamp     = 08.12.2154 02:01:58,32
Datum/Zeit    = Sonntag, 08.Dezember 2154, 02:01:58
absolute Zeit = 786.708 Tage == 6.797.157.851.832 HS
15.09.138 14:01:58,32
374:01:58,32
138 Jahre 09 Monate 15 Tage, 14:01:58,32
138,800 Jahre / 1.665,602 Monate / 7.241,798 Wochen / 50.692,585 Tage / 1.216.622,033 h / 72.997.321,972 min / 4.379.839.318,32 s
nachher:6.801.047.688.540
Wochentag     = Dienstag
TT.MM.JJ      = 02.03.56
TT.MM.JJJJ    = 02.03.2156
JJJJ-MM-TT    = 2156-03-02
HH:MM:SS      = 07:08:05
HH:MM:SS,MS   = 07:08:05,40
Timestamp     = 02.03.2156 07:08:05,40
Datum/Zeit    = Dienstag, 02.M„rz 2156, 07:08:05
absolute Zeit = 787.158 Tage == 6.801.047.688.540 HS
08.00.140 19:08:05,40
211:08:05,40
140 Jahre 00 Monate 08 Tage, 19:08:05,40
140,033 Jahre / 1.680,394 Monate / 7.306,114 Wochen / 51.142,797 Tage / 1.227.427,135 h / 73.645.628,090 min / 4.418.737.685,40 s
i=61
vorher: 6.801.047.688.540
nachher:6.804.529.974.641
Wochentag     = Sonnabend
TT.MM.JJ      = 09.04.57
TT.MM.JJJJ    = 09.04.2157
JJJJ-MM-TT    = 2157-04-09
HH:MM:SS      = 08:09:06
HH:MM:SS,MS   = 08:09:06,41
Timestamp     = 09.04.2157 08:09:06,41
Datum/Zeit    = Sonnabend, 09.April 2157, 08:09:06
absolute Zeit = 787.561 Tage == 6.804.529.974.641 HS
17.01.141 20:09:06,41
428:09:06,41
141 Jahre 01 Monate 17 Tage, 20:09:06,41
141,136 Jahre / 1.693,637 Monate / 7.363,691 Wochen / 51.545,840 Tage / 1.237.100,152 h / 74.226.009,107 min / 4.453.560.546,41 s
nachher:6.808.419.811.349
Wochentag     = Montag
TT.MM.JJ      = 03.07.58
TT.MM.JJJJ    = 03.07.2158
JJJJ-MM-TT    = 2158-07-03
HH:MM:SS      = 13:15:13
HH:MM:SS,MS   = 13:15:13,49
Timestamp     = 03.07.2158 13:15:13,49
Datum/Zeit    = Montag, 03.Juli 2158, 13:15:13
absolute Zeit = 788.011 Tage == 6.808.419.811.349 HS
11.04.142 01:15:13,49
265:15:13,49
142 Jahre 04 Monate 11 Tage, 01:15:13,49
142,369 Jahre / 1.708,430 Monate / 7.428,007 Wochen / 51.996,052 Tage / 1.247.905,254 h / 74.874.315,225 min / 4.492.458.913,49 s
i=62
vorher: 6.808.419.811.349
nachher:6.811.902.097.450
Wochentag     = Freitag
TT.MM.JJ      = 10.08.59
TT.MM.JJJJ    = 10.08.2159
JJJJ-MM-TT    = 2159-08-10
HH:MM:SS      = 14:16:14
HH:MM:SS,MS   = 14:16:14,50
Timestamp     = 10.08.2159 14:16:14,50
Datum/Zeit    = Freitag, 10.August 2159, 14:16:14
absolute Zeit = 788.414 Tage == 6.811.902.097.450 HS
19.05.143 02:16:14,50
458:16:14,50
143 Jahre 05 Monate 19 Tage, 02:16:14,50
143,473 Jahre / 1.721,672 Monate / 7.485,585 Wochen / 52.399,095 Tage / 1.257.578,271 h / 75.454.696,242 min / 4.527.281.774,50 s
nachher:6.815.791.934.158
Wochentag     = Sonntag
TT.MM.JJ      = 02.11.60
TT.MM.JJJJ    = 02.11.2160
JJJJ-MM-TT    = 2160-11-02
HH:MM:SS      = 19:22:21
HH:MM:SS,MS   = 19:22:21,58
Timestamp     = 02.11.2160 19:22:21,58
Datum/Zeit    = Sonntag, 02.November 2160, 19:22:21
absolute Zeit = 788.864 Tage == 6.815.791.934.158 HS
11.08.144 07:22:21,58
271:22:21,58
144 Jahre 08 Monate 11 Tage, 07:22:21,58
144,705 Jahre / 1.736,465 Monate / 7.549,901 Wochen / 52.849,307 Tage / 1.268.383,373 h / 76.103.002,360 min / 4.566.180.141,58 s
i=63
vorher: 6.815.791.934.158
nachher:6.819.274.220.259
Wochentag     = Donnerstag
TT.MM.JJ      = 10.12.61
TT.MM.JJJJ    = 10.12.2161
JJJJ-MM-TT    = 2161-12-10
HH:MM:SS      = 20:23:22
HH:MM:SS,MS   = 20:23:22,59
Timestamp     = 10.12.2161 20:23:22,59
Datum/Zeit    = Donnerstag, 10.Dezember 2161, 20:23:22
absolute Zeit = 789.267 Tage == 6.819.274.220.259 HS
18.09.145 08:23:22,59
440:23:22,59
145 Jahre 09 Monate 18 Tage, 08:23:22,59
145,809 Jahre / 1.749,708 Monate / 7.607,479 Wochen / 53.252,350 Tage / 1.278.056,390 h / 76.683.383,376 min / 4.601.003.002,59 s
nachher:6.823.164.056.967
Wochentag     = Sonntag
TT.MM.JJ      = 06.03.63
TT.MM.JJJJ    = 06.03.2163
JJJJ-MM-TT    = 2163-03-06
HH:MM:SS      = 01:29:29
HH:MM:SS,MS   = 01:29:29,67
Timestamp     = 06.03.2163 01:29:29,67
Datum/Zeit    = Sonntag, 06.M„rz 2163, 01:29:29
absolute Zeit = 789.718 Tage == 6.823.164.056.967 HS
12.00.147 13:29:29,67
301:29:29,67
147 Jahre 00 Monate 12 Tage, 13:29:29,67
147,042 Jahre / 1.764,500 Monate / 7.671,795 Wochen / 53.702,562 Tage / 1.288.861,492 h / 77.331.689,494 min / 4.639.901.369,67 s
i=64
vorher: 6.823.164.056.967
nachher:6.826.646.343.068
Wochentag     = Donnerstag
TT.MM.JJ      = 12.04.64
TT.MM.JJJJ    = 12.04.2164
JJJJ-MM-TT    = 2164-04-12
HH:MM:SS      = 02:30:30
HH:MM:SS,MS   = 02:30:30,68
Timestamp     = 12.04.2164 02:30:30,68
Datum/Zeit    = Donnerstag, 12.April 2164, 02:30:30
absolute Zeit = 790.121 Tage == 6.826.646.343.068 HS
20.01.148 14:30:30,68
494:30:30,68
148 Jahre 01 Monate 20 Tage, 14:30:30,68
148,145 Jahre / 1.777,743 Monate / 7.729,372 Wochen / 54.105,605 Tage / 1.298.534,509 h / 77.912.070,511 min / 4.674.724.230,68 s
nachher:6.830.536.179.776
Wochentag     = Sonnabend
TT.MM.JJ      = 06.07.65
TT.MM.JJJJ    = 06.07.2165
JJJJ-MM-TT    = 2165-07-06
HH:MM:SS      = 07:36:37
HH:MM:SS,MS   = 07:36:37,76
Timestamp     = 06.07.2165 07:36:37,76
Datum/Zeit    = Sonnabend, 06.Juli 2165, 07:36:37
absolute Zeit = 790.571 Tage == 6.830.536.179.776 HS
13.04.149 19:36:37,76
331:36:37,76
149 Jahre 04 Monate 13 Tage, 19:36:37,76
149,378 Jahre / 1.792,535 Monate / 7.793,688 Wochen / 54.555,817 Tage / 1.309.339,610 h / 78.560.376,629 min / 4.713.622.597,76 s
i=65
vorher: 6.830.536.179.776
nachher:6.834.018.465.877
Wochentag     = Mittwoch
TT.MM.JJ      = 13.08.66
TT.MM.JJJJ    = 13.08.2166
JJJJ-MM-TT    = 2166-08-13
HH:MM:SS      = 08:37:38
HH:MM:SS,MS   = 08:37:38,77
Timestamp     = 13.08.2166 08:37:38,77
Datum/Zeit    = Mittwoch, 13.August 2166, 08:37:38
absolute Zeit = 790.974 Tage == 6.834.018.465.877 HS
21.05.150 20:37:38,77
524:37:38,77
150 Jahre 05 Monate 21 Tage, 20:37:38,77
150,482 Jahre / 1.805,778 Monate / 7.851,266 Wochen / 54.958,859 Tage / 1.319.012,627 h / 79.140.757,646 min / 4.748.445.458,77 s
nachher:6.837.908.302.585
Wochentag     = Freitag
TT.MM.JJ      = 06.11.67
TT.MM.JJJJ    = 06.11.2167
JJJJ-MM-TT    = 2167-11-06
HH:MM:SS      = 13:43:45
HH:MM:SS,MS   = 13:43:45,85
Timestamp     = 06.11.2167 13:43:45,85
Datum/Zeit    = Freitag, 06.November 2167, 13:43:45
absolute Zeit = 791.424 Tage == 6.837.908.302.585 HS
15.08.151 01:43:45,85
361:43:45,85
151 Jahre 08 Monate 15 Tage, 01:43:45,85
151,714 Jahre / 1.820,571 Monate / 7.915,582 Wochen / 55.409,072 Tage / 1.329.817,729 h / 79.789.063,764 min / 4.787.343.825,85 s
i=66
vorher: 6.837.908.302.585
nachher:6.841.390.588.686
Wochentag     = Dienstag
TT.MM.JJ      = 13.12.68
TT.MM.JJJJ    = 13.12.2168
JJJJ-MM-TT    = 2168-12-13
HH:MM:SS      = 14:44:46
HH:MM:SS,MS   = 14:44:46,86
Timestamp     = 13.12.2168 14:44:46,86
Datum/Zeit    = Dienstag, 13.Dezember 2168, 14:44:46
absolute Zeit = 791.827 Tage == 6.841.390.588.686 HS
21.09.152 02:44:46,86
506:44:46,86
152 Jahre 09 Monate 21 Tage, 02:44:46,86
152,818 Jahre / 1.833,814 Monate / 7.973,159 Wochen / 55.812,114 Tage / 1.339.490,746 h / 80.369.444,781 min / 4.822.166.686,86 s
nachher:6.845.280.425.394
Wochentag     = Donnerstag
TT.MM.JJ      = 08.03.70
TT.MM.JJJJ    = 08.03.2170
JJJJ-MM-TT    = 2170-03-08
HH:MM:SS      = 19:50:53
HH:MM:SS,MS   = 19:50:53,94
Timestamp     = 08.03.2170 19:50:53,94
Datum/Zeit    = Donnerstag, 08.M„rz 2170, 19:50:53
absolute Zeit = 792.277 Tage == 6.845.280.425.394 HS
15.00.154 07:50:53,94
367:50:53,94
154 Jahre 00 Monate 15 Tage, 07:50:53,94
154,051 Jahre / 1.848,606 Monate / 8.037,475 Wochen / 56.262,327 Tage / 1.350.295,848 h / 81.017.750,899 min / 4.861.065.053,94 s
i=67
vorher: 6.845.280.425.394
nachher:6.848.762.711.495
Wochentag     = Montag
TT.MM.JJ      = 15.04.71
TT.MM.JJJJ    = 15.04.2171
JJJJ-MM-TT    = 2171-04-15
HH:MM:SS      = 20:51:54
HH:MM:SS,MS   = 20:51:54,95
Timestamp     = 15.04.2171 20:51:54,95
Datum/Zeit    = Montag, 15.April 2171, 20:51:54
absolute Zeit = 792.680 Tage == 6.848.762.711.495 HS
24.01.155 08:51:54,95
584:51:54,95
155 Jahre 01 Monate 24 Tage, 08:51:54,95
155,154 Jahre / 1.861,849 Monate / 8.095,053 Wochen / 56.665,369 Tage / 1.359.968,865 h / 81.598.131,916 min / 4.895.887.914,95 s
nachher:6.852.652.548.203
Wochentag     = Donnerstag
TT.MM.JJ      = 09.07.72
TT.MM.JJJJ    = 09.07.2172
JJJJ-MM-TT    = 2172-07-09
HH:MM:SS      = 01:58:02
HH:MM:SS,MS   = 01:58:02,03
Timestamp     = 09.07.2172 01:58:02,03
Datum/Zeit    = Donnerstag, 09.Juli 2172, 01:58:02
absolute Zeit = 793.131 Tage == 6.852.652.548.203 HS
16.04.156 13:58:02,03
397:58:02,03
156 Jahre 04 Monate 16 Tage, 13:58:02,03
156,387 Jahre / 1.876,641 Monate / 8.159,369 Wochen / 57.115,582 Tage / 1.370.773,967 h / 82.246.438,034 min / 4.934.786.282,03 s
i=68
vorher: 6.852.652.548.203
nachher:6.856.134.834.304
Wochentag     = Montag
TT.MM.JJ      = 16.08.73
TT.MM.JJJJ    = 16.08.2173
JJJJ-MM-TT    = 2173-08-16
HH:MM:SS      = 02:59:03
HH:MM:SS,MS   = 02:59:03,04
Timestamp     = 16.08.2173 02:59:03,04
Datum/Zeit    = Montag, 16.August 2173, 02:59:03
absolute Zeit = 793.534 Tage == 6.856.134.834.304 HS
24.05.157 14:59:03,04
590:59:03,04
157 Jahre 05 Monate 24 Tage, 14:59:03,04
157,490 Jahre / 1.889,884 Monate / 8.216,946 Wochen / 57.518,624 Tage / 1.380.446,984 h / 82.826.819,051 min / 4.969.609.143,04 s
nachher:6.860.024.671.012
Wochentag     = Mittwoch
TT.MM.JJ      = 09.11.74
TT.MM.JJJJ    = 09.11.2174
JJJJ-MM-TT    = 2174-11-09
HH:MM:SS      = 08:05:10
HH:MM:SS,MS   = 08:05:10,12
Timestamp     = 09.11.2174 08:05:10,12
Datum/Zeit    = Mittwoch, 09.November 2174, 08:05:10
absolute Zeit = 793.984 Tage == 6.860.024.671.012 HS
17.08.158 20:05:10,12
428:05:10,12
158 Jahre 08 Monate 17 Tage, 20:05:10,12
158,723 Jahre / 1.904,677 Monate / 8.281,262 Wochen / 57.968,837 Tage / 1.391.252,086 h / 83.475.125,169 min / 5.008.507.510,12 s
i=69
vorher: 6.860.024.671.012
nachher:6.863.506.957.113
Wochentag     = Sonntag
TT.MM.JJ      = 17.12.75
TT.MM.JJJJ    = 17.12.2175
JJJJ-MM-TT    = 2175-12-17
HH:MM:SS      = 09:06:11
HH:MM:SS,MS   = 09:06:11,13
Timestamp     = 17.12.2175 09:06:11,13
Datum/Zeit    = Sonntag, 17.Dezember 2175, 09:06:11
absolute Zeit = 794.387 Tage == 6.863.506.957.113 HS
24.09.159 21:06:11,13
597:06:11,13
159 Jahre 09 Monate 24 Tage, 21:06:11,13
159,827 Jahre / 1.917,919 Monate / 8.338,840 Wochen / 58.371,879 Tage / 1.400.925,103 h / 84.055.506,185 min / 5.043.330.371,13 s
nachher:6.867.396.793.821
Wochentag     = Dienstag
TT.MM.JJ      = 11.03.77
TT.MM.JJJJ    = 11.03.2177
JJJJ-MM-TT    = 2177-03-11
HH:MM:SS      = 14:12:18
HH:MM:SS,MS   = 14:12:18,21
Timestamp     = 11.03.2177 14:12:18,21
Datum/Zeit    = Dienstag, 11.M„rz 2177, 14:12:18
absolute Zeit = 794.837 Tage == 6.867.396.793.821 HS
18.00.161 02:12:18,21
434:12:18,21
161 Jahre 00 Monate 18 Tage, 02:12:18,21
161,059 Jahre / 1.932,712 Monate / 8.403,156 Wochen / 58.822,092 Tage / 1.411.730,205 h / 84.703.812,303 min / 5.082.228.738,21 s
i=70
vorher: 6.867.396.793.821
nachher:6.870.879.079.922
Wochentag     = Sonnabend
TT.MM.JJ      = 18.04.78
TT.MM.JJJJ    = 18.04.2178
JJJJ-MM-TT    = 2178-04-18
HH:MM:SS      = 15:13:19
HH:MM:SS,MS   = 15:13:19,22
Timestamp     = 18.04.2178 15:13:19,22
Datum/Zeit    = Sonnabend, 18.April 2178, 15:13:19
absolute Zeit = 795.240 Tage == 6.870.879.079.922 HS
27.01.162 03:13:19,22
651:13:19,22
162 Jahre 01 Monate 27 Tage, 03:13:19,22
162,163 Jahre / 1.945,955 Monate / 8.460,733 Wochen / 59.225,134 Tage / 1.421.403,222 h / 85.284.193,320 min / 5.117.051.599,22 s
nachher:6.874.768.916.630
Wochentag     = Montag
TT.MM.JJ      = 12.07.79
TT.MM.JJJJ    = 12.07.2179
JJJJ-MM-TT    = 2179-07-12
HH:MM:SS      = 20:19:26
HH:MM:SS,MS   = 20:19:26,30
Timestamp     = 12.07.2179 20:19:26,30
Datum/Zeit    = Montag, 12.Juli 2179, 20:19:26
absolute Zeit = 795.690 Tage == 6.874.768.916.630 HS
20.04.163 08:19:26,30
488:19:26,30
163 Jahre 04 Monate 20 Tage, 08:19:26,30
163,396 Jahre / 1.960,747 Monate / 8.525,050 Wochen / 59.675,347 Tage / 1.432.208,324 h / 85.932.499,438 min / 5.155.949.966,30 s
i=71
vorher: 6.874.768.916.630
nachher:6.878.251.202.731
Wochentag     = Freitag
TT.MM.JJ      = 18.08.80
TT.MM.JJJJ    = 18.08.2180
JJJJ-MM-TT    = 2180-08-18
HH:MM:SS      = 21:20:27
HH:MM:SS,MS   = 21:20:27,31
Timestamp     = 18.08.2180 21:20:27,31
Datum/Zeit    = Freitag, 18.August 2180, 21:20:27
absolute Zeit = 796.093 Tage == 6.878.251.202.731 HS
27.05.164 09:20:27,31
657:20:27,31
164 Jahre 05 Monate 27 Tage, 09:20:27,31
164,499 Jahre / 1.973,990 Monate / 8.582,627 Wochen / 60.078,389 Tage / 1.441.881,341 h / 86.512.880,455 min / 5.190.772.827,31 s
nachher:6.882.141.039.439
Wochentag     = Montag
TT.MM.JJ      = 12.11.81
TT.MM.JJJJ    = 12.11.2181
JJJJ-MM-TT    = 2181-11-12
HH:MM:SS      = 02:26:34
HH:MM:SS,MS   = 02:26:34,39
Timestamp     = 12.11.2181 02:26:34,39
Datum/Zeit    = Montag, 12.November 2181, 02:26:34
absolute Zeit = 796.544 Tage == 6.882.141.039.439 HS
20.08.165 14:26:34,39
494:26:34,39
165 Jahre 08 Monate 20 Tage, 14:26:34,39
165,732 Jahre / 1.988,783 Monate / 8.646,943 Wochen / 60.528,602 Tage / 1.452.686,443 h / 87.161.186,573 min / 5.229.671.194,39 s
i=72
vorher: 6.882.141.039.439
nachher:6.885.623.325.540
Wochentag     = Freitag
TT.MM.JJ      = 20.12.82
TT.MM.JJJJ    = 20.12.2182
JJJJ-MM-TT    = 2182-12-20
HH:MM:SS      = 03:27:35
HH:MM:SS,MS   = 03:27:35,40
Timestamp     = 20.12.2182 03:27:35,40
Datum/Zeit    = Freitag, 20.Dezember 2182, 03:27:35
absolute Zeit = 796.947 Tage == 6.885.623.325.540 HS
27.09.166 15:27:35,40
663:27:35,40
166 Jahre 09 Monate 27 Tage, 15:27:35,40
166,835 Jahre / 2.002,025 Monate / 8.704,521 Wochen / 60.931,644 Tage / 1.462.359,460 h / 87.741.567,590 min / 5.264.494.055,40 s
nachher:6.889.513.162.248
Wochentag     = Sonntag
TT.MM.JJ      = 14.03.84
TT.MM.JJJJ    = 14.03.2184
JJJJ-MM-TT    = 2184-03-14
HH:MM:SS      = 08:33:42
HH:MM:SS,MS   = 08:33:42,48
Timestamp     = 14.03.2184 08:33:42,48
Datum/Zeit    = Sonntag, 14.M„rz 2184, 08:33:42
absolute Zeit = 797.397 Tage == 6.889.513.162.248 HS
20.00.168 20:33:42,48
500:33:42,48
168 Jahre 00 Monate 20 Tage, 20:33:42,48
168,068 Jahre / 2.016,818 Monate / 8.768,837 Wochen / 61.381,857 Tage / 1.473.164,562 h / 88.389.873,708 min / 5.303.392.422,48 s
i=73
vorher: 6.889.513.162.248
nachher:6.892.995.448.349
Wochentag     = Donnerstag
TT.MM.JJ      = 21.04.85
TT.MM.JJJJ    = 21.04.2185
JJJJ-MM-TT    = 2185-04-21
HH:MM:SS      = 09:34:43
HH:MM:SS,MS   = 09:34:43,49
Timestamp     = 21.04.2185 09:34:43,49
Datum/Zeit    = Donnerstag, 21.April 2185, 09:34:43
absolute Zeit = 797.800 Tage == 6.892.995.448.349 HS
29.01.169 21:34:43,49
717:34:43,49
169 Jahre 01 Monate 29 Tage, 21:34:43,49
169,172 Jahre / 2.030,061 Monate / 8.826,414 Wochen / 61.784,899 Tage / 1.482.837,579 h / 88.970.254,725 min / 5.338.215.283,49 s
nachher:6.896.885.285.057
Wochentag     = Sonnabend
TT.MM.JJ      = 15.07.86
TT.MM.JJJJ    = 15.07.2186
JJJJ-MM-TT    = 2186-07-15
HH:MM:SS      = 14:40:50
HH:MM:SS,MS   = 14:40:50,57
Timestamp     = 15.07.2186 14:40:50,57
Datum/Zeit    = Sonnabend, 15.Juli 2186, 14:40:50
absolute Zeit = 798.250 Tage == 6.896.885.285.057 HS
23.04.170 02:40:50,57
554:40:50,57
170 Jahre 04 Monate 23 Tage, 02:40:50,57
170,404 Jahre / 2.044,853 Monate / 8.890,730 Wochen / 62.235,112 Tage / 1.493.642,681 h / 89.618.560,843 min / 5.377.113.650,57 s
i=74
vorher: 6.896.885.285.057
nachher:6.900.367.571.158
Wochentag     = Mittwoch
TT.MM.JJ      = 22.08.87
TT.MM.JJJJ    = 22.08.2187
JJJJ-MM-TT    = 2187-08-22
HH:MM:SS      = 15:41:51
HH:MM:SS,MS   = 15:41:51,58
Timestamp     = 22.08.2187 15:41:51,58
Datum/Zeit    = Mittwoch, 22.August 2187, 15:41:51
absolute Zeit = 798.653 Tage == 6.900.367.571.158 HS
00.06.171 03:41:51,58
03:41:51,58
171 Jahre 06 Monate 00 Tage, 03:41:51,58
171,508 Jahre / 2.058,096 Monate / 8.948,308 Wochen / 62.638,154 Tage / 1.503.315,698 h / 90.198.941,860 min / 5.411.936.511,58 s
nachher:6.904.257.407.866
Wochentag     = Freitag
TT.MM.JJ      = 14.11.88
TT.MM.JJJJ    = 14.11.2188
JJJJ-MM-TT    = 2188-11-14
HH:MM:SS      = 20:47:58
HH:MM:SS,MS   = 20:47:58,66
Timestamp     = 14.11.2188 20:47:58,66
Datum/Zeit    = Freitag, 14.November 2188, 20:47:58
absolute Zeit = 799.103 Tage == 6.904.257.407.866 HS
23.08.172 08:47:58,66
560:47:58,66
172 Jahre 08 Monate 23 Tage, 08:47:58,66
172,741 Jahre / 2.072,889 Monate / 9.012,624 Wochen / 63.088,367 Tage / 1.514.120,800 h / 90.847.247,978 min / 5.450.834.878,66 s
i=75
vorher: 6.904.257.407.866
nachher:6.907.739.693.967
Wochentag     = Dienstag
TT.MM.JJ      = 22.12.89
TT.MM.JJJJ    = 22.12.2189
JJJJ-MM-TT    = 2189-12-22
HH:MM:SS      = 21:48:59
HH:MM:SS,MS   = 21:48:59,67
Timestamp     = 22.12.2189 21:48:59,67
Datum/Zeit    = Dienstag, 22.Dezember 2189, 21:48:59
absolute Zeit = 799.506 Tage == 6.907.739.693.967 HS
00.10.173 09:48:59,67
09:48:59,67
173 Jahre 10 Monate 00 Tage, 09:48:59,67
173,844 Jahre / 2.086,131 Monate / 9.070,201 Wochen / 63.491,409 Tage / 1.523.793,817 h / 91.427.628,994 min / 5.485.657.739,67 s
nachher:6.911.629.530.675
Wochentag     = Freitag
TT.MM.JJ      = 18.03.91
TT.MM.JJJJ    = 18.03.2191
JJJJ-MM-TT    = 2191-03-18
HH:MM:SS      = 02:55:06
HH:MM:SS,MS   = 02:55:06,75
Timestamp     = 18.03.2191 02:55:06,75
Datum/Zeit    = Freitag, 18.M„rz 2191, 02:55:06
absolute Zeit = 799.957 Tage == 6.911.629.530.675 HS
24.00.175 14:55:06,75
590:55:06,75
175 Jahre 00 Monate 24 Tage, 14:55:06,75
175,077 Jahre / 2.100,924 Monate / 9.134,517 Wochen / 63.941,622 Tage / 1.534.598,919 h / 92.075.935,112 min / 5.524.556.106,75 s
i=76
vorher: 6.911.629.530.675
nachher:6.915.111.816.776
Wochentag     = Dienstag
TT.MM.JJ      = 24.04.92
TT.MM.JJJJ    = 24.04.2192
JJJJ-MM-TT    = 2192-04-24
HH:MM:SS      = 03:56:07
HH:MM:SS,MS   = 03:56:07,76
Timestamp     = 24.04.2192 03:56:07,76
Datum/Zeit    = Dienstag, 24.April 2192, 03:56:07
absolute Zeit = 800.360 Tage == 6.915.111.816.776 HS
01.02.176 15:56:07,76
39:56:07,76
176 Jahre 02 Monate 01 Tage, 15:56:07,76
176,181 Jahre / 2.114,167 Monate / 9.192,095 Wochen / 64.344,664 Tage / 1.544.271,935 h / 92.656.316,129 min / 5.559.378.967,76 s
nachher:6.919.001.653.484
Wochentag     = Donnerstag
TT.MM.JJ      = 18.07.93
TT.MM.JJJJ    = 18.07.2193
JJJJ-MM-TT    = 2193-07-18
HH:MM:SS      = 09:02:14
HH:MM:SS,MS   = 09:02:14,84
Timestamp     = 18.07.2193 09:02:14,84
Datum/Zeit    = Donnerstag, 18.Juli 2193, 09:02:14
absolute Zeit = 800.810 Tage == 6.919.001.653.484 HS
25.04.177 21:02:14,84
621:02:14,84
177 Jahre 04 Monate 25 Tage, 21:02:14,84
177,413 Jahre / 2.128,959 Monate / 9.256,411 Wochen / 64.794,877 Tage / 1.555.077,037 h / 93.304.622,247 min / 5.598.277.334,84 s
i=77
vorher: 6.919.001.653.484
nachher:6.922.483.939.585
Wochentag     = Montag
TT.MM.JJ      = 25.08.94
TT.MM.JJJJ    = 25.08.2194
JJJJ-MM-TT    = 2194-08-25
HH:MM:SS      = 10:03:15
HH:MM:SS,MS   = 10:03:15,85
Timestamp     = 25.08.2194 10:03:15,85
Datum/Zeit    = Montag, 25.August 2194, 10:03:15
absolute Zeit = 801.213 Tage == 6.922.483.939.585 HS
02.06.178 22:03:15,85
70:03:15,85
178 Jahre 06 Monate 02 Tage, 22:03:15,85
178,517 Jahre / 2.142,202 Monate / 9.313,988 Wochen / 65.197,919 Tage / 1.564.750,054 h / 93.885.003,264 min / 5.633.100.195,85 s
nachher:6.926.373.776.293
Wochentag     = Mittwoch
TT.MM.JJ      = 18.11.95
TT.MM.JJJJ    = 18.11.2195
JJJJ-MM-TT    = 2195-11-18
HH:MM:SS      = 15:09:22
HH:MM:SS,MS   = 15:09:22,93
Timestamp     = 18.11.2195 15:09:22,93
Datum/Zeit    = Mittwoch, 18.November 2195, 15:09:22
absolute Zeit = 801.663 Tage == 6.926.373.776.293 HS
27.08.179 03:09:22,93
651:09:22,93
179 Jahre 08 Monate 27 Tage, 03:09:22,93
179,750 Jahre / 2.156,995 Monate / 9.378,305 Wochen / 65.648,132 Tage / 1.575.555,156 h / 94.533.309,382 min / 5.671.998.562,93 s
i=78
vorher: 6.926.373.776.293
nachher:6.929.856.062.394
Wochentag     = Sonntag
TT.MM.JJ      = 25.12.96
TT.MM.JJJJ    = 25.12.2196
JJJJ-MM-TT    = 2196-12-25
HH:MM:SS      = 16:10:23
HH:MM:SS,MS   = 16:10:23,94
Timestamp     = 25.12.2196 16:10:23,94
Datum/Zeit    = Sonntag, 25.Dezember 2196, 16:10:23
absolute Zeit = 802.066 Tage == 6.929.856.062.394 HS
03.10.180 04:10:23,94
76:10:23,94
180 Jahre 10 Monate 03 Tage, 04:10:23,94
180,853 Jahre / 2.170,237 Monate / 9.435,882 Wochen / 66.051,174 Tage / 1.585.228,173 h / 95.113.690,399 min / 5.706.821.423,94 s
nachher:6.933.745.899.102
Wochentag     = Dienstag
TT.MM.JJ      = 20.03.98
TT.MM.JJJJ    = 20.03.2198
JJJJ-MM-TT    = 2198-03-20
HH:MM:SS      = 21:16:31
HH:MM:SS,MS   = 21:16:31,02
Timestamp     = 20.03.2198 21:16:31,02
Datum/Zeit    = Dienstag, 20.M„rz 2198, 21:16:31
absolute Zeit = 802.516 Tage == 6.933.745.899.102 HS
27.00.182 09:16:31,02
657:16:31,02
182 Jahre 00 Monate 27 Tage, 09:16:31,02
182,086 Jahre / 2.185,030 Monate / 9.500,198 Wochen / 66.501,386 Tage / 1.596.033,275 h / 95.761.996,517 min / 5.745.719.791,02 s
i=79
vorher: 6.933.745.899.102
nachher:6.937.228.185.203
Wochentag     = Sonnabend
TT.MM.JJ      = 27.04.99
TT.MM.JJJJ    = 27.04.2199
JJJJ-MM-TT    = 2199-04-27
HH:MM:SS      = 22:17:32
HH:MM:SS,MS   = 22:17:32,03
Timestamp     = 27.04.2199 22:17:32,03
Datum/Zeit    = Sonnabend, 27.April 2199, 22:17:32
absolute Zeit = 802.919 Tage == 6.937.228.185.203 HS
05.02.183 10:17:32,03
130:17:32,03
183 Jahre 02 Monate 05 Tage, 10:17:32,03
183,189 Jahre / 2.198,273 Monate / 9.557,776 Wochen / 66.904,429 Tage / 1.605.706,292 h / 96.342.377,534 min / 5.780.542.652,03 s
nachher:6.941.118.021.911
Wochentag     = Dienstag
TT.MM.JJ      = 22.07.00
TT.MM.JJJJ    = 22.07.2200
JJJJ-MM-TT    = 2200-07-22
HH:MM:SS      = 03:23:39
HH:MM:SS,MS   = 03:23:39,11
Timestamp     = 22.07.2200 03:23:39,11
Datum/Zeit    = Dienstag, 22.Juli 2200, 03:23:39
absolute Zeit = 803.370 Tage == 6.941.118.021.911 HS
29.04.184 15:23:39,11
711:23:39,11
184 Jahre 04 Monate 29 Tage, 15:23:39,11
184,422 Jahre / 2.213,065 Monate / 9.622,092 Wochen / 67.354,641 Tage / 1.616.511,394 h / 96.990.683,652 min / 5.819.441.019,11 s
i=80
vorher: 6.941.118.021.911
nachher:6.944.600.308.012
Wochentag     = Sonnabend
TT.MM.JJ      = 29.08.01
TT.MM.JJJJ    = 29.08.2201
JJJJ-MM-TT    = 2201-08-29
HH:MM:SS      = 04:24:40
HH:MM:SS,MS   = 04:24:40,12
Timestamp     = 29.08.2201 04:24:40,12
Datum/Zeit    = Sonnabend, 29.August 2201, 04:24:40
absolute Zeit = 803.773 Tage == 6.944.600.308.012 HS
06.06.185 16:24:40,12
160:24:40,12
185 Jahre 06 Monate 06 Tage, 16:24:40,12
185,526 Jahre / 2.226,308 Monate / 9.679,669 Wochen / 67.757,684 Tage / 1.626.184,411 h / 97.571.064,669 min / 5.854.263.880,12 s
nachher:6.948.490.144.720
Wochentag     = Montag
TT.MM.JJ      = 22.11.02
TT.MM.JJJJ    = 22.11.2202
JJJJ-MM-TT    = 2202-11-22
HH:MM:SS      = 09:30:47
HH:MM:SS,MS   = 09:30:47,20
Timestamp     = 22.11.2202 09:30:47,20
Datum/Zeit    = Montag, 22.November 2202, 09:30:47
absolute Zeit = 804.223 Tage == 6.948.490.144.720 HS
30.08.186 21:30:47,20
741:30:47,20
186 Jahre 08 Monate 30 Tage, 21:30:47,20
186,758 Jahre / 2.241,101 Monate / 9.743,985 Wochen / 68.207,896 Tage / 1.636.989,513 h / 98.219.370,787 min / 5.893.162.247,20 s
i=81
vorher: 6.948.490.144.720
nachher:6.951.972.430.821
Wochentag     = Freitag
TT.MM.JJ      = 30.12.03
TT.MM.JJJJ    = 30.12.2203
JJJJ-MM-TT    = 2203-12-30
HH:MM:SS      = 10:31:48
HH:MM:SS,MS   = 10:31:48,21
Timestamp     = 30.12.2203 10:31:48,21
Datum/Zeit    = Freitag, 30.Dezember 2203, 10:31:48
absolute Zeit = 804.626 Tage == 6.951.972.430.821 HS
07.10.187 22:31:48,21
190:31:48,21
187 Jahre 10 Monate 07 Tage, 22:31:48,21
187,862 Jahre / 2.254,343 Monate / 9.801,563 Wochen / 68.610,939 Tage / 1.646.662,530 h / 98.799.751,803 min / 5.927.985.108,21 s
nachher:6.955.862.267.529
Wochentag     = Sonntag
TT.MM.JJ      = 24.03.05
TT.MM.JJJJ    = 24.03.2205
JJJJ-MM-TT    = 2205-03-24
HH:MM:SS      = 15:37:55
HH:MM:SS,MS   = 15:37:55,29
Timestamp     = 24.03.2205 15:37:55,29
Datum/Zeit    = Sonntag, 24.M„rz 2205, 15:37:55
absolute Zeit = 805.076 Tage == 6.955.862.267.529 HS
02.01.189 03:37:55,29
51:37:55,29
189 Jahre 01 Monate 02 Tage, 03:37:55,29
189,095 Jahre / 2.269,136 Monate / 9.865,879 Wochen / 69.061,151 Tage / 1.657.467,632 h / 99.448.057,921 min / 5.966.883.475,29 s
i=82
vorher: 6.955.862.267.529
nachher:6.959.344.553.630
Wochentag     = Donnerstag
TT.MM.JJ      = 01.05.06
TT.MM.JJJJ    = 01.05.2206
JJJJ-MM-TT    = 2206-05-01
HH:MM:SS      = 16:38:56
HH:MM:SS,MS   = 16:38:56,30
Timestamp     = 01.05.2206 16:38:56,30
Datum/Zeit    = Donnerstag, 01.Mai 2206, 16:38:56
absolute Zeit = 805.479 Tage == 6.959.344.553.630 HS
09.02.190 04:38:56,30
220:38:56,30
190 Jahre 02 Monate 09 Tage, 04:38:56,30
190,198 Jahre / 2.282,379 Monate / 9.923,456 Wochen / 69.464,194 Tage / 1.667.140,649 h / 100.028.438,938 min / 6.001.706.336,30 s
nachher:6.963.234.390.338
Wochentag     = Sonnabend
TT.MM.JJ      = 25.07.07
TT.MM.JJJJ    = 25.07.2207
JJJJ-MM-TT    = 2207-07-25
HH:MM:SS      = 21:45:03
HH:MM:SS,MS   = 21:45:03,38
Timestamp     = 25.07.2207 21:45:03,38
Datum/Zeit    = Sonnabend, 25.Juli 2207, 21:45:03
absolute Zeit = 805.929 Tage == 6.963.234.390.338 HS
03.05.191 09:45:03,38
81:45:03,38
191 Jahre 05 Monate 03 Tage, 09:45:03,38
191,431 Jahre / 2.297,171 Monate / 9.987,772 Wochen / 69.914,406 Tage / 1.677.945,751 h / 100.676.745,056 min / 6.040.604.703,38 s
i=83
vorher: 6.963.234.390.338
nachher:6.966.716.676.439
Wochentag     = Mittwoch
TT.MM.JJ      = 31.08.08
TT.MM.JJJJ    = 31.08.2208
JJJJ-MM-TT    = 2208-08-31
HH:MM:SS      = 22:46:04
HH:MM:SS,MS   = 22:46:04,39
Timestamp     = 31.08.2208 22:46:04,39
Datum/Zeit    = Mittwoch, 31.August 2208, 22:46:04
absolute Zeit = 806.332 Tage == 6.966.716.676.439 HS
09.06.192 10:46:04,39
226:46:04,39
192 Jahre 06 Monate 09 Tage, 10:46:04,39
192,534 Jahre / 2.310,414 Monate / 10.045,350 Wochen / 70.317,449 Tage / 1.687.618,768 h / 101.257.126,073 min / 6.075.427.564,39 s
nachher:6.970.606.513.147
Wochentag     = Sonnabend
TT.MM.JJ      = 25.11.09
TT.MM.JJJJ    = 25.11.2209
JJJJ-MM-TT    = 2209-11-25
HH:MM:SS      = 03:52:11
HH:MM:SS,MS   = 03:52:11,47
Timestamp     = 25.11.2209 03:52:11,47
Datum/Zeit    = Sonnabend, 25.November 2209, 03:52:11
absolute Zeit = 806.783 Tage == 6.970.606.513.147 HS
02.09.193 15:52:11,47
63:52:11,47
193 Jahre 09 Monate 02 Tage, 15:52:11,47
193,767 Jahre / 2.325,207 Monate / 10.109,666 Wochen / 70.767,661 Tage / 1.698.423,870 h / 101.905.432,191 min / 6.114.325.931,47 s
i=84
vorher: 6.970.606.513.147
nachher:6.974.088.799.248
Wochentag     = Mittwoch
TT.MM.JJ      = 02.01.11
TT.MM.JJJJ    = 02.01.2211
JJJJ-MM-TT    = 2211-01-02
HH:MM:SS      = 04:53:12
HH:MM:SS,MS   = 04:53:12,48
Timestamp     = 02.01.2211 04:53:12,48
Datum/Zeit    = Mittwoch, 02.Januar 2211, 04:53:12
absolute Zeit = 807.186 Tage == 6.974.088.799.248 HS
10.10.194 16:53:12,48
256:53:12,48
194 Jahre 10 Monate 10 Tage, 16:53:12,48
194,871 Jahre / 2.338,449 Monate / 10.167,243 Wochen / 71.170,704 Tage / 1.708.096,887 h / 102.485.813,208 min / 6.149.148.792,48 s
nachher:6.977.978.635.956
Wochentag     = Freitag
TT.MM.JJ      = 27.03.12
TT.MM.JJJJ    = 27.03.2212
JJJJ-MM-TT    = 2212-03-27
HH:MM:SS      = 09:59:19
HH:MM:SS,MS   = 09:59:19,56
Timestamp     = 27.03.2212 09:59:19,56
Datum/Zeit    = Freitag, 27.M„rz 2212, 09:59:19
absolute Zeit = 807.636 Tage == 6.977.978.635.956 HS
04.01.196 21:59:19,56
117:59:19,56
196 Jahre 01 Monate 04 Tage, 21:59:19,56
196,103 Jahre / 2.353,242 Monate / 10.231,559 Wochen / 71.620,916 Tage / 1.718.901,989 h / 103.134.119,326 min / 6.188.047.159,56 s
i=85
vorher: 6.977.978.635.956
nachher:6.981.460.922.057
Wochentag     = Dienstag
TT.MM.JJ      = 04.05.13
TT.MM.JJJJ    = 04.05.2213
JJJJ-MM-TT    = 2213-05-04
HH:MM:SS      = 11:00:20
HH:MM:SS,MS   = 11:00:20,57
Timestamp     = 04.05.2213 11:00:20,57
Datum/Zeit    = Dienstag, 04.Mai 2213, 11:00:20
absolute Zeit = 808.039 Tage == 6.981.460.922.057 HS
11.02.197 23:00:20,57
287:00:20,57
197 Jahre 02 Monate 11 Tage, 23:00:20,57
197,207 Jahre / 2.366,485 Monate / 10.289,137 Wochen / 72.023,959 Tage / 1.728.575,006 h / 103.714.500,343 min / 6.222.870.020,57 s
nachher:6.985.350.758.765
Wochentag     = Donnerstag
TT.MM.JJ      = 28.07.14
TT.MM.JJJJ    = 28.07.2214
JJJJ-MM-TT    = 2214-07-28
HH:MM:SS      = 16:06:27
HH:MM:SS,MS   = 16:06:27,65
Timestamp     = 28.07.2214 16:06:27,65
Datum/Zeit    = Donnerstag, 28.Juli 2214, 16:06:27
absolute Zeit = 808.489 Tage == 6.985.350.758.765 HS
06.05.198 04:06:27,65
148:06:27,65
198 Jahre 05 Monate 06 Tage, 04:06:27,65
198,440 Jahre / 2.381,277 Monate / 10.353,453 Wochen / 72.474,171 Tage / 1.739.380,108 h / 104.362.806,461 min / 6.261.768.387,65 s
i=86
vorher: 6.985.350.758.765
nachher:6.988.833.044.866
Wochentag     = Montag
TT.MM.JJ      = 04.09.15
TT.MM.JJJJ    = 04.09.2215
JJJJ-MM-TT    = 2215-09-04
HH:MM:SS      = 17:07:28
HH:MM:SS,MS   = 17:07:28,66
Timestamp     = 04.09.2215 17:07:28,66
Datum/Zeit    = Montag, 04.September 2215, 17:07:28
absolute Zeit = 808.892 Tage == 6.988.833.044.866 HS
13.06.199 05:07:28,66
317:07:28,66
199 Jahre 06 Monate 13 Tage, 05:07:28,66
199,543 Jahre / 2.394,520 Monate / 10.411,031 Wochen / 72.877,214 Tage / 1.749.053,125 h / 104.943.187,478 min / 6.296.591.248,66 s
nachher:6.992.722.881.574
Wochentag     = Mittwoch
TT.MM.JJ      = 27.11.16
TT.MM.JJJJ    = 27.11.2216
JJJJ-MM-TT    = 2216-11-27
HH:MM:SS      = 22:13:35
HH:MM:SS,MS   = 22:13:35,74
Timestamp     = 27.11.2216 22:13:35,74
Datum/Zeit    = Mittwoch, 27.November 2216, 22:13:35
absolute Zeit = 809.342 Tage == 6.992.722.881.574 HS
05.09.200 10:13:35,74
130:13:35,74
200 Jahre 09 Monate 05 Tage, 10:13:35,74
200,776 Jahre / 2.409,313 Monate / 10.475,347 Wochen / 73.327,426 Tage / 1.759.858,227 h / 105.591.493,596 min / 6.335.489.615,74 s
i=87
vorher: 6.992.722.881.574
nachher:6.996.205.167.675
Wochentag     = Sonntag
TT.MM.JJ      = 04.01.18
TT.MM.JJJJ    = 04.01.2218
JJJJ-MM-TT    = 2218-01-04
HH:MM:SS      = 23:14:36
HH:MM:SS,MS   = 23:14:36,75
Timestamp     = 04.01.2218 23:14:36,75
Datum/Zeit    = Sonntag, 04.Januar 2218, 23:14:36
absolute Zeit = 809.745 Tage == 6.996.205.167.675 HS
13.10.201 11:14:36,75
323:14:36,75
201 Jahre 10 Monate 13 Tage, 11:14:36,75
201,880 Jahre / 2.422,555 Monate / 10.532,924 Wochen / 73.730,468 Tage / 1.769.531,244 h / 106.171.874,612 min / 6.370.312.476,75 s
nachher:7.000.095.004.383
Wochentag     = Mittwoch
TT.MM.JJ      = 31.03.19
TT.MM.JJJJ    = 31.03.2219
JJJJ-MM-TT    = 2219-03-31
HH:MM:SS      = 04:20:43
HH:MM:SS,MS   = 04:20:43,83
Timestamp     = 31.03.2219 04:20:43,83
Datum/Zeit    = Mittwoch, 31.M„rz 2219, 04:20:43
absolute Zeit = 810.196 Tage == 7.000.095.004.383 HS
08.01.203 16:20:43,83
208:20:43,83
203 Jahre 01 Monate 08 Tage, 16:20:43,83
203,112 Jahre / 2.437,348 Monate / 10.597,240 Wochen / 74.180,681 Tage / 1.780.336,346 h / 106.820.180,730 min / 6.409.210.843,83 s
i=88
vorher: 7.000.095.004.383
nachher:7.003.577.290.484
Wochentag     = Sonntag
TT.MM.JJ      = 07.05.20
TT.MM.JJJJ    = 07.05.2220
JJJJ-MM-TT    = 2220-05-07
HH:MM:SS      = 05:21:44
HH:MM:SS,MS   = 05:21:44,84
Timestamp     = 07.05.2220 05:21:44,84
Datum/Zeit    = Sonntag, 07.Mai 2220, 05:21:44
absolute Zeit = 810.599 Tage == 7.003.577.290.484 HS
14.02.204 17:21:44,84
353:21:44,84
204 Jahre 02 Monate 14 Tage, 17:21:44,84
204,216 Jahre / 2.450,591 Monate / 10.654,818 Wochen / 74.583,723 Tage / 1.790.009,362 h / 107.400.561,747 min / 6.444.033.704,84 s
nachher:7.007.467.127.192
Wochentag     = Dienstag
TT.MM.JJ      = 31.07.21
TT.MM.JJJJ    = 31.07.2221
JJJJ-MM-TT    = 2221-07-31
HH:MM:SS      = 10:27:51
HH:MM:SS,MS   = 10:27:51,92
Timestamp     = 31.07.2221 10:27:51,92
Datum/Zeit    = Dienstag, 31.Juli 2221, 10:27:51
absolute Zeit = 811.049 Tage == 7.007.467.127.192 HS
08.05.205 22:27:51,92
214:27:51,92
205 Jahre 05 Monate 08 Tage, 22:27:51,92
205,449 Jahre / 2.465,383 Monate / 10.719,134 Wochen / 75.033,936 Tage / 1.800.814,464 h / 108.048.867,865 min / 6.482.932.071,92 s
i=89
vorher: 7.007.467.127.192
nachher:7.010.949.413.293
Wochentag     = Sonnabend
TT.MM.JJ      = 07.09.22
TT.MM.JJJJ    = 07.09.2222
JJJJ-MM-TT    = 2222-09-07
HH:MM:SS      = 11:28:52
HH:MM:SS,MS   = 11:28:52,93
Timestamp     = 07.09.2222 11:28:52,93
Datum/Zeit    = Sonnabend, 07.September 2222, 11:28:52
absolute Zeit = 811.452 Tage == 7.010.949.413.293 HS
15.06.206 23:28:52,93
383:28:52,93
206 Jahre 06 Monate 15 Tage, 23:28:52,93
206,552 Jahre / 2.478,626 Monate / 10.776,711 Wochen / 75.436,978 Tage / 1.810.487,481 h / 108.629.248,882 min / 6.517.754.932,93 s
nachher:7.014.839.250.001
Wochentag     = Montag
TT.MM.JJ      = 01.12.23
TT.MM.JJJJ    = 01.12.2223
JJJJ-MM-TT    = 2223-12-01
HH:MM:SS      = 16:35:00
HH:MM:SS,MS   = 16:35:00,01
Timestamp     = 01.12.2223 16:35:00,01
Datum/Zeit    = Montag, 01.Dezember 2223, 16:35:00
absolute Zeit = 811.902 Tage == 7.014.839.250.001 HS
09.09.207 04:35:00,01
220:35:00,01
207 Jahre 09 Monate 09 Tage, 04:35:00,01
207,785 Jahre / 2.493,418 Monate / 10.841,027 Wochen / 75.887,191 Tage / 1.821.292,583 h / 109.277.555,000 min / 6.556.653.300,01 s
i=90
vorher: 7.014.839.250.001
nachher:7.018.321.536.102
Wochentag     = Freitag
TT.MM.JJ      = 07.01.25
TT.MM.JJJJ    = 07.01.2225
JJJJ-MM-TT    = 2225-01-07
HH:MM:SS      = 17:36:01
HH:MM:SS,MS   = 17:36:01,02
Timestamp     = 07.01.2225 17:36:01,02
Datum/Zeit    = Freitag, 07.Januar 2225, 17:36:01
absolute Zeit = 812.305 Tage == 7.018.321.536.102 HS
16.10.208 05:36:01,02
389:36:01,02
208 Jahre 10 Monate 16 Tage, 05:36:01,02
208,888 Jahre / 2.506,661 Monate / 10.898,605 Wochen / 76.290,233 Tage / 1.830.965,600 h / 109.857.936,017 min / 6.591.476.161,02 s
nachher:7.022.211.372.810
Wochentag     = Sonntag
TT.MM.JJ      = 02.04.26
TT.MM.JJJJ    = 02.04.2226
JJJJ-MM-TT    = 2226-04-02
HH:MM:SS      = 22:42:08
HH:MM:SS,MS   = 22:42:08,10
Timestamp     = 02.04.2226 22:42:08,10
Datum/Zeit    = Sonntag, 02.April 2226, 22:42:08
absolute Zeit = 812.755 Tage == 7.022.211.372.810 HS
11.01.210 10:42:08,10
274:42:08,10
210 Jahre 01 Monate 11 Tage, 10:42:08,10
210,121 Jahre / 2.521,454 Monate / 10.962,921 Wochen / 76.740,446 Tage / 1.841.770,702 h / 110.506.242,135 min / 6.630.374.528,10 s
i=91
vorher: 7.022.211.372.810
nachher:7.025.693.658.911
Wochentag     = Donnerstag
TT.MM.JJ      = 10.05.27
TT.MM.JJJJ    = 10.05.2227
JJJJ-MM-TT    = 2227-05-10
HH:MM:SS      = 23:43:09
HH:MM:SS,MS   = 23:43:09,11
Timestamp     = 10.05.2227 23:43:09,11
Datum/Zeit    = Donnerstag, 10.Mai 2227, 23:43:09
absolute Zeit = 813.158 Tage == 7.025.693.658.911 HS
18.02.211 11:43:09,11
443:43:09,11
211 Jahre 02 Monate 18 Tage, 11:43:09,11
211,225 Jahre / 2.534,697 Monate / 11.020,498 Wochen / 77.143,488 Tage / 1.851.443,719 h / 111.086.623,152 min / 6.665.197.389,11 s
nachher:7.029.583.495.619
Wochentag     = Sonntag
TT.MM.JJ      = 03.08.28
TT.MM.JJJJ    = 03.08.2228
JJJJ-MM-TT    = 2228-08-03
HH:MM:SS      = 04:49:16
HH:MM:SS,MS   = 04:49:16,19
Timestamp     = 03.08.2228 04:49:16,19
Datum/Zeit    = Sonntag, 03.August 2228, 04:49:16
absolute Zeit = 813.609 Tage == 7.029.583.495.619 HS
11.05.212 16:49:16,19
280:49:16,19
212 Jahre 05 Monate 11 Tage, 16:49:16,19
212,457 Jahre / 2.549,489 Monate / 11.084,814 Wochen / 77.593,701 Tage / 1.862.248,821 h / 111.734.929,270 min / 6.704.095.756,19 s
i=92
vorher: 7.029.583.495.619
nachher:7.033.065.781.720
Wochentag     = Donnerstag
TT.MM.JJ      = 10.09.29
TT.MM.JJJJ    = 10.09.2229
JJJJ-MM-TT    = 2229-09-10
HH:MM:SS      = 05:50:17
HH:MM:SS,MS   = 05:50:17,20
Timestamp     = 10.09.2229 05:50:17,20
Datum/Zeit    = Donnerstag, 10.September 2229, 05:50:17
absolute Zeit = 814.012 Tage == 7.033.065.781.720 HS
18.06.213 17:50:17,20
449:50:17,20
213 Jahre 06 Monate 18 Tage, 17:50:17,20
